26272035,"
X factors | Playoff race calls
Upset watch | What to watch
Greg Wyshynski, senior NHL writer: Rick Tocchet is getting Jack Adams buzz for coaching an injury-plagued Arizona Coyotes team to the wild-card bundle, and you can tell he's a true Coach of the Year candidate because it's a goalie who's actually propping up the team. Darcy Kuemper has been really outstanding since taking the crease in December. In his last 18 appearances, he's 12-5-1 with a .927 save percentage. Kuemper has a 14.69 goals-saved above average this season and is in the top 10 for goalies in point shares (the number of standings points contributed by a player) with 9.2.
He's been the Coyotes' MVP and will have to continue to be for Arizona to make the playoff cut. It's pretty incredible to think that the Coyotes acquired him last deadline for Tobias Rieder, who is currently with the Edmonton Oilers and doesn't have a goal in 56 games this season.
Who has the best playoff chances? What teams are poised to land Jack Hughes with the No. 1 pick? Projections for both, plus the most important games today.
On second thought, Patrice Bergeron & Co. do get enough love. Plus, the Week in Gritty, Jersey Fouls and more.
Dimitri Filipovic, hockey analytics writer: Sidney Crosby. He's been doing it for so long that we almost take his greatness for granted at this point, but Crosby is currently putting the finishing touches on a vintage individual season. No player has more primary 5-on-5 points than his 46 this season, which speaks to the nearly unparalleled direct impact he's had on his team's offensive output.
The Pittsburgh Penguins' play with him on the ice versus when he's on the bench has been night and day this season. In the roughly 1,050 5-on-5 minutes he's played, they're up 75-35 on the scoreboard. In the 2,370 minutes he hasn't been out there, they're down 87-100. Whether it's been Dominik Simon or Bryan Rust or most recently Jared McCann, whoever has gotten to play on his wing has their production skyrocket to whole new heights.
Crosby himself has really ratcheted his game up a level of late, registering 10 goals and 19 assists over his past 16 games. The Penguins have unsurprisingly gone 10-3-3 during that time, going from the edge of the playoff bubble to having a realistic chance at winning the Metropolitan Division. If he can keep this up and carry the team up the standings, he'll be well deserving of some late-season MVP buzz.
Victoria Matiash, fantasy analyst: He's saying all the right things after ugly losses to the Lightning and Blackhawks, but now Auston Matthews must lead his club by example. The Toronto Maple Leafs' best player needs to perform as such, at both ends of the ice, and score with greater regularity.
Sitting four points back of the Bruins, themselves losers of three straight, Toronto has failed to take advantage in the fight for home ice. That has to change. Bet your bottom Canadian dollar, once Matthews erupts for a multipoint night (the goal and assist after falling behind 5-0 early to Chicago on Wednesday doesn't count), the rest of the Leafs' lineup will follow. While having a healthy Jake Gardiner and Travis Dermott back on the blue line is essential for this club to have any chance against Boston, the cream of Toronto's forward crop must play to their peak before then. And that starts with No. 34.
Ben Arledge, associate NHL editor: You could name just about any goalie here: Jordan Binnington, Petr Mrazek, Ben Bishop, Sergei Bobrovsky, Carey Price and so on. But moving outside the crease, I think Carolina's Sebastian Aho ends up being the most important skater down the stretch. The winger currently leads his team with 30 goals and 77 points while skating 20 minutes per night. According to Natural Stat Trick, Aho is third on the team in relative Corsi at plus-8.7, and the team scores 2.4 more goals per 60 minutes when he is skating (highest on the Canes).
The Hurricanes sit in a playoff berth by two points, not only trying to hold off a pair of challengers for the wild-card spots but also trying to catch the Penguins in the third Metropolitan seat. It's a very tight race, and with the Canes' offense running through Aho, they will need him at his best for the final month.

Sachin Chandan, ESPN the Magazine researcher: In the past month, captain Joe Pavelski has led the San Jose Sharks in goals and points while they are locked into a razor-thin race with the Flames for top seed. Earlier in the week, he scored a game winner against the Jets with 4.3 seconds left, and he's on the doorstep of scoring 40 goals for the first time since 2014. The Sharks have the best record in the West at home, and the race for the top seed is critical to their chances of making the Cup Final. With the Sharks dealing with injuries, they'll need Pavelski to play a critical role with games coming up against Nashville and Vegas.
Wyshynski: The Montreal Canadiens make the playoffs. This really isn't what anybody outside of Montreal wants, given that the playoffs are a much more interesting place with the Blue Jackets, Hurricanes and Penguins in them, but Montreal just keeps chugging along. And check the schedule: The Habs have four-point-swing games against the Hurricanes and Jackets, and their last three games (Tampa, Washington and Toronto) could see those teams resting key players down the stretch. I would be happy to be wrong here, but I think there's a better chance that Montreal stays steady than either the Hurricanes or the Blue Jackets don't flake down the stretch.
Filipovic: The Colorado Avalanche make the playoffs. It's not necessarily that bold considering they're only five points out of a playoff spot at the moment, but this time of year it's immensely difficult to make up any sort of real ground considering how loser points are being handed out like candy on a nightly basis. They'll also need to leapfrog a pair of teams to do so.
The good news for the Avalanche is that they have a direct say in their own destiny because they still have meetings with the Wild, Stars and Coyotes. They also have juicy matchups against bottom-feeders like the Ducks, Devils and Blackhawks, all of whom they should feast on. They're certainly facing an uphill battle without Gabriel Landeskog in the lineup, but their goaltending appears to have rebounded from a midseason malaise. After completely falling off the face of the earth in December and January, their goalies have bounced back to the top 10 of both 5-on-5 and all situations save percentage since the start of February. The Avs need that to continue if they're going to make a spirited run down the stretch.
Matiash: The Chicago Blackhawks make the playoffs. And not only because Patrick Kane is producing at a ridiculous pace. The entire lineup is clearly buying what newbie coach Jeremy Colliton is peddling. Together, Jonathan Toews and Brandon Saad are enjoying solid rebound campaigns, and fans of our fantasy content will be familiar with my affection for the underrated young forward duo of Alex DeBrincat and Dylan Strome. Finally healthy, goalie Corey Crawford -- and this I did not anticipate at all -- is looking like his old self. Winning games against both stronger and weaker sides, these experienced Blackhawks have a perceptible edge on the Coyotes and Landeskog-less Avalanche. I predict they vault the Wild as well.
Arledge: The Arizona Coyotes make the playoffs. Yes, they currently have a three-point lead over the Wild in the Western's final wild-card seat and have a five-point advantage over the Avalanche. Not that bold on the surface. But consider this: They currently do not roster a player with 20 or more goals (Brad Richardson leads the team with 16). Their leading point-getter (Clayton Keller, 45) is tied for 99th in the NHL. Only eight regulars have a positive plus-minus. The team as a whole is 21st in Corsi and its 7.0 even-strength shooting percentage is second worst in the league. Oh, and the No. 1 goaltender at the start of the season, Antti Raanta, hasn't played since November. But none of it matters.
The Coyotes have won 13 of their last 17 riding Kuemper (.930 save percentage following the All-Star break), Vinnie Hinostroza and Alex Galchenyuk. It'd be their first playoff berth since 2012, when Ray Whitney and Shane Doan helped them all the way to the conference finals. Nothing is going to slow this team's momentum.

Chandan: The Minnesota Wild miss the playoffs. They are currently on the outside looking in, and I can't see them climbing back in with a difficult strength of schedule remaining compared to the Stars and Blues. Should the Wild miss, it would end the longest active playoff streak in the Western Conference, as they've made it six years in a row. In fact, the Wild have 10 games remaining against teams currently in the playoffs, a brutal stretch that includes two against the Stars, who are three points ahead of them.
Catch more than 180 NHL games streaming live this season on ESPN+. Click here for the upcoming schedule and to learn how to subscribe.
Wyshynski: The Dallas Stars over the Nashville Predators. If you want to take stock of the regular-season series, the Stars were 2-1-2 against the Predators. But give me Bishop, a money postseason goalie who's been waiting four years for another playoff shot, over either of the Predators' netminders in a series. Give me a Stars team ready to get a jolt from a rested and healthy Mats Zuccarello. And don't give me a Nashville team that has looked disjointed for most of the season. We thought it was the injuries. Maybe it isn't.
Filipovic: I'll go with the Carolina Hurricanes taking down the New York Islanders in the opening round. It feels like a bit of a cop-out because the Islanders are such an easy target and aren't even sitting in a position to make this matchup happen right now, but whoever finishes the year winning the Metro seems ripe for an upset by the first wild card. Whether it's the Capitals, Islanders or Penguins, there are some legitimate flaws that can be exposed in a playoff series. And whether it's the Hurricanes, Blue Jackets or even the Canadiens, they each have enough going for them to conceivably take advantage of those opportunities.
That entire side of the playoff bracket is about as wide open as you'll see. I'm going with this particular combination just because it would represent a big win for nerds everywhere, with the first-ranked shot-share team and analytical darling beating the higher-seeded but 22nd-ranked shot-share team.
Arledge: The Carolina Hurricanes over the Washington Capitals. The young up-and-coming team that's earned points in 16 of its last 20 contests knocks off Alex Ovechkin and the defending champions. No wild-card team is taking down the Lightning, and the Jets, Predators, Sharks and Flames probably all have at least one series win in them.
That leaves the Metropolitan Division, where the Caps currently lead the Islanders by two points (and I agree with Dimitri that the Isles would also be a big target here). Washington ought to hold off New York, but if Mrazek gets hot heading into the playoffs, and Aho, Teuvo Teravainen & Co. continue to find ways to score, the Hurricanes will be a pest in late April.

Chandan: The Arizona Coyotes over the Winnipeg Jets would be a wild turn of fate, but I'm a sucker for hot goalies in the playoffs. The Jets have struggled with consistency issues and bad luck, going 4-7-1 in the past month. Connor Hellebuyck has had a lousy .894 save percentage in that span. There's still time to right the ship, but they could be staring at a dangerous matchup. The Coyotes have shocked the NHL with their run into the playoff picture, and as Greg points out above, Kuemper's been the hottest thing in the desert over the past month. Oh, and there are reports that Antti Raanta could be back in the net for the Coyotes come playoff time if Kuemper does start to run cold. I could see this going six or seven.
Wyshynski: Carolina on home ice. The Hurricanes have the most favorable home/road split in the Eastern Conference down the stretch, with eight of their remaining 13 games at PNC Arena. Among those games: Winnable contests against the Sabres, Flyers and Wild; critical ones against Montreal and Pittsburgh; tough ones against Washington and Tampa Bay; and a bye against the Devils.
Postgame analysis and highlight show airing each night throughout the season from Barry Melrose and Linda Cohn. Watch on ESPN+
They've been a better defensive team on home ice (2.66 GAA) than on the road (2.80), and slightly better offensively as well, despite a 15.5 percent conversion rate on the power play at home. It's entirely possible that their playoff seed will be won or lost based on how they feast on these home games. One hopes the fans recognize this and fill the building to cheer on this Bunch of Jerks.
Filipovic: I've already written about this at greater length, but the battle between the Sharks and Flames for not only Pacific Division supremacy but also the No. 1 seed out West is what I'll be watching. There's currently one measly point separating the two, and it'll all likely come down to their  meeting in San Jose on March 31. While both teams have already punched their tickets to the postseason regardless of the outcome, the difference between the two possible scenarios should be enough to inspire some added urgency.
Coming out atop the division promises not only a significantly easier matchup in Round 1 but also guarantees home-ice advantage in a potential Round 2 meeting. Considering that it could very plausibly be the difference between a disappointing first-round exit and a Western Conference final appearance, it's a race that warrants our undivided attention.
Matiash: John Tortorella's handling of the Blue Jackets. With Columbus, Montreal and Carolina in a heated battle for the pair of wild-card spots in the East, it's going to get tense. For the average hockey fan, it sets the stage for terrific theater with Tortorella as a leading cast member. How does he get more out of ex-Senators Matt Duchene and Ryan Dzingel? How does he manage Bobrovsky's workload and confidence? How does he handle questions from the media?
There isn't a coach in the playoff mix under more pressure than the Jackets' bench boss, after the organization opted to go all-in ahead of the trade deadline. And this charge could go right down to the wire. Can't wait.
Arledge: Pacific Division starting goalies. The Sharks might be leading the Pacific at the moment with 94 points, but their goaltending duo has been awful. Both Martin Jones and Aaron Dell have save percentages south of .900, and the Sharks' 5-on-5 save percentage is dead last in the NHL. San Jose missed a big opportunity at the trade deadline to pad its crease with someone like Jimmy Howard, and it could end up costing the team dearly. The Sharks are currently giving up more than three goals per night.
Then you have the Flames, who have relied on David Rittich and a fading Mike Smith this season. Rittich has an .882 save percentage and 3.35 goals-against average since the All-Star break, cooling significantly from his hot start. According to Natural Stat Trick, his goals saved above average is just 0.02, 32nd in the NHL among goalies with at least 10 games played. Can he really hold down the fort through the playoffs? Both of these teams are just too good to let down because of mediocre-to-bad goaltending, and Dimitri already pointed out just how important this stretch run is for this pair of clubs, so I'll be looking to see whether one of these guys can get hot in the closing weeks. You don't want to head into the first round still trying to get right in the crease.
"
26050547,"Kucherov, who leads the NHL in scoring, reached the century mark in the Lightning's 62nd game when he finished a 2-on-1 with Tyler Johnson for his 30th goal of the season. He's the fastest to 100 points since 1996-97, when Mario Lemieux did it in the Penguins' 61st game.
It's Feb. 21 and @86Kucherov has 100 points.The 25-year-old @TBLightning forward is the first player in 22 years to hit 100 points in 62 or fewer games - Mario Lemieux did so in his 61st game in 1996-97. #NHLStats pic.twitter.com/Vb2VoUwCrw
""That was a special moment,"" Kucherov said.
""He's a remarkable player, and he's having an amazing season,"" Lightning coach Jon Cooper said.
Steven Stamkos and Kucherov scored in the shootout, giving Tampa Bay a 2-1 win and 100 points on the season. The Lightning, who ran their winning streak to eight on Thursday, are the fastest team to 47 wins in NHL history.
Nikita Kucherov became the fastest player to 100 points in a season since Mario Lemieux, and he and Steven Stamkos scored in the shootout to lift the Tampa Bay Lightning over the Buffalo Sabres 2-1 on Thursday night.
We're used to delayed gratification in the NHL, but the Lightning have waited long enough to be crowned champions.
Kucherov, 25, is in his sixth season with the Lightning and has now reached 100 points for a second straight year. A second-round draft pick of the Lightning in 2011, he is one of three Tampa Bay players -- along with Brayden Point and Stamkos -- among the NHL's top 10 scorers.
Kucherov, who now has four consecutive 30-goal seasons, becomes the sixth active player to record consecutive 100-point seasons, joining Joe Thornton, Sidney Crosby, Evgeni Malkin, Alex Ovechkin and Connor McDavid. He is also the fourth Russian-born player to record consecutive 100-point seasons in NHL history, joining Pavel Bure, Malkin and Ovechkin.
""I think I quit getting impressed [by Kucherov] at the start of the year,"" Johnson said. ""It's just expected now.""
Information from ESPN Stats and Information and The Associated Press was used in this report.
"
26231216,"""We accepted Eugene Binda's resignation. We appreciate what he did for us in the nine years he's been [with the FHL]. Now we'll see which officials want to stay, if there's any new ones and if any of the officials in his stable want to carry on with us,"" said Andrew Richards, the league's vice commissioner, told ESPN.
The Federal Hockey League is a Single-A professional minor league in its ninth season of operation that currently has six teams.
Binda said he resigned after this incident because if it was the latest in a series involving his officials.
""We've had enough. This league has been known for not protecting our guys. But we've never been physically assaulted. This one here was over the edge, and we're taking a stand. We're not going to be treated this way,"" he told ESPN on Monday. ""I don't go to work to get beat up. I don't go to work to get spit on.""
According to Elmira police, officers were called to First Arena at around 5 p.m. on Sunday for a report of a disturbance at the Enforcers' game against the Carolina Thunderbirds. Officers were met with an ""unruly crowd"" complaining of inconsistent performance by the on-ice officials, and the aftermath of a physical altercation between the game officials and ""Elmira Enforcers team management"" in owner Robbie Nichols. Once everyone went to their respective locker rooms, officers conducted interviews with all involved.
""It should be noted that no one was hurt and/or injured nor were any reported. Due to the altercation FHL Officials suspended play and the game was subsequently terminated. After further conversation with the parties involved this matter is closed upon their request and requires nothing more at this time,"" Elmira police said in a statement.
The game had taken an ugly turn early in the first period when Enforcers captain Ahmed Mahfouz was sent to the hospital following an illegal check from a Thunderbirds player, one that resulted in a five-minute major penalty and a misconduct. That scene left Nichols angry.
""They're like family. They become your kids,"" he told ESPN in a phone interview on Monday.
He grew even angrier when Carolina was awarded a goal by head coach/player Andre Niche. He said a replay on the arena's Jumbotron clearly showed the goal shouldn't have counted.
""The referee pointed down 10 times to say it's a goal, and the replay shows that the puck never crossed the line. So me, being a former hockey player and coach, I was upset. When they came off the ice at the end of the period, I was standing there, with my arms crossed, asking why the in F did he call that a goal?"" said Nichols, who was drafted by the Philadelphia Flyers in 1983 and played in the Detroit Red Wings' minor league system.
""Never in my life have I had a referee walk right through me. Like, he just bumped and pushed me out of the way -- we have video. Then, this linesman comes flying in and just double-pushes me. Look, I got a new heart valve and a separated shoulder and I'm kinda old now. So I pushed him back, and it was a little scene.""
A report by local station WETM said that Nichols ""was held back as he swung his arms."" He denies swinging his arms but acknowledges he was being held back from the officials by team personnel.
After the incident, the officials returned to the ice, where the head referee called Binda, the supervisor of officials for the FHL. The decision was made for them to not continue officiating the game.
""I was yelling at him from the hallway. But then the guy said he felt his life was being threatened. They called the police, had them escorted out of the building, and it just carried on like that,"" said Nichols.
Elmira chief of police Joseph Kane told ESPN all three game officials and Nichols were interviewed after the game. ""Towards the end of this, the three referees decided they didn't want to pursue any charges. As of now, it's my understanding that they didn't want anybody charged,"" said Kane.
Binda said the officials are, in fact, seeking to press charges.
""That's completed inaccurate. The officials want to press charges,"" he said. ""The [ref] that was on the ice was a former New York police officer. He wanted the state police, not the local cops.""
After the referees left the game, Nichols called FHL commissioner Don Kirnan.
""I said, 'This has never happened to me before. What do you do?'"" said Nichols. ""I told him there were some guys around that were linesmen in the AHL and asked if I should call them. But he said that we had to call the game.""
The Elmira vs. Carolina game officially appears as ""canceled"" on the FHL website. The Enforcers still held their ""chuck-a-puck"" contest and players still took part in a ""skate with the fans"" promotion that day. Fans holding tickets to that game could use them on Wednesday for an exhibition between Elmira and the New York City Fire Department hockey team or on Saturday against Watertown. But with over 2,000 fans in attendance, the Enforcers lost a significant amount of concession revenue minus two periods and an intermission.
Nichols said the FHL hadn't indicated if he was going to be disciplined for the incident.
Binda was responsible for the coordination of officials in the FHL, including assignments and acting a liaison between them, the teams and the league. He's also referee-in-chief for the Eastern Junior Hockey League (EJHL), Empire Junior Hockey League (EmJHL), Eastern Hockey Federation, and Massachusetts Selects Hockey League.
In an email acquired by Bus League Hockey, Binda used the scheduling site Horizon Web Ref to indicate he was done with the Federal League.
""I have been with the FHL since its inaugural season and have battled with the league on multiple occasions on the safety of the officiating staff, today was the last straw. I cannot in good conscience continue in my role as the supervisor of officials and in the future have one of you seriously injured by a player or team administrator,"" he wrote. ""I am going to unpublished (sic) call the games until the league figures out who they want to take over. I will not be back!""
Richards said he's confident the FHL will have officials available for this weekend's games, with potential replacement referees and linesmen ""coming out of the woodwork,"" including some who have worked in the American Hockey League and ECHL. ""We're moving forward with a plan to get qualified officials on the ice,"" he said.
Nichols said he's embarrassed with how the incident played out. ""I'm one of those guys that can tell you when I'm wrong. It would have been easier if I had never gone back into the tunnel,"" he said. ""I'm embarrassed that it went down like this.""
"
