25724303,"How we rank: We use a panel of voters, and these rankings reflect which teams voters think would win head-to-head matchups. Higher-ranked teams are favored over lower-ranked teams. A run of wins doesn't guarantee a jump, and a couple of losses doesn't guarantee a fall.
Previous ranking: 1
Points pace: 130. The Lightning are on pace for the best regular season since the Red Wings amassed 131 points in 1995-96. They're a full-on juggernaut, but there's a reason no one has cracked 130 points in 23 years. Under.
Previous ranking: 2
Points pace: 109. The Leafs were a 105-point team last season, so this mark is very much in reach. As long as goaltender Frederik Andersen remains steady (and healthy), this team will hit 110 points or better. Over.
Previous ranking: 5
Points pace: 109. The Flames are for real, and that plus-31 goal differential isn't just a product of better-than-expected goaltending. (And a .902 save percentage is ahead of where we thought they'd be.) Getting to 108 points in the wacky West is a tall order, but they're 100 percent a 100-point team. Under.
Football is king in the Cotton State, but from Huntsville to Birmingham and, yes, Tuscaloosa, there are many puckheads to be found.
The drawback to a muscular posterior? It's tough to find a pair of jeans that will fit. Connor McDavid and other NHL stars chronicle the struggle.
Only two goalies have won the Hart Trophy as MVP this millennium. Here's why the Ducks goalie should be No. 3, plus updates on all the other award races.
Previous ranking: 8
Points pace: 104. Due respect to the Sharks' recent roll and the return of Erik Karlsson to public adulation, but I can't trust a team with a .893 save percentage to stay on this pace. However, it's a playoff team, for sure. Under.
Previous ranking: 6
Points pace: 104. The Predators were a 117-point team last season, and this current pace comes after three months of significant injuries to top players like Filip Forsberg and P.K. Subban. A fully armed and operational Predators team will power past this current pace. Over.
Previous ranking: 4
Points pace: 109. This would be ahead of where the Capitals finished last season. As Alex Ovechkin showed with his All-Star Game decision, Washington knows that slow and steady can win the race again. Under.
Previous ranking: 3
Points pace: 109. The Jets are at this pace with Connor Hellebuyck playing to a .909 save percentage and Patrik Laine with one goal since Dec. 16. Those trends are going to reverse, and GM Kevin Cheveldayoff is going to pull off another Paul Stastny-esque move at the deadline. Over.
This week's episode makes some ESPN On Ice history. To incorporate the voice of the listener, Greg Wyshynski and Emily Kaplan opened up the phone lines to field great hockey questions from our loyal fan base. Plus, find out if we get stumped by this week's ""Sach Got Your Number."" And Linda Cohn advises what the New York Rangers should do in the way of future front-office moves. Listen »
Previous ranking: 9
Points pace: 103. The Knights are probably a team that lands at around 100 points, but if there's anything we've learned in the past year, it's to not bet against Vegas. Over.
Previous ranking: 10
Points pace: 103. The goaltending has figured itself out, Sidney Crosby is playing at an MVP level and they're on an 11-2-0 roll. To quote an ancient ad campaign for an adult beverage: Beware of the Penguins. Over.
Previous ranking: 7
Points pace: 103. The Bruins and Leafs will flip-flop in the standings, with Toronto getting the No. 2 seed and home ice and Boston getting right around 103 points. Conservatively, we'll say they're just a shade below it. Under.
Previous ranking: 11
Points pace: 100. The teams chasing the top three in the Metropolitan are starting to close the gap a bit. We're a little worried about what GM Jarmo Kekalainen does with Artemi Panarin and Sergei Bobrovsky. The Jackets have been a 100-point team only once in franchise history. John Tortorella has hit that number only three times in 14 full seasons as an NHL coach. Under.
Previous ranking: 14
Points pace: 100. The Islanders are riding the PDO train this season (102.82 in combined shooting and save percentages). They're an amazing story, and they could very well be a playoff team, but they're probably also crossing the finish line with double-digit points. Under.
Catch more than 180 NHL games streaming live this season on ESPN+. Click here for the upcoming schedule and to learn how to subscribe.
Previous ranking: 12
Points pace: 99. Are the Sabres going to have a 37-point improvement from last season? No. But they're going to have a 30-plus-point improvement, which is nothing to be ashamed of. Under.
Previous ranking: 18
Points pace: 93. If team president Jim Lites can savage his best players in profanity-laced tirades to the media every month or so, they're money. (Also, it'll be a big help if Ben Bishop keeps doing what he's been doing.) Over.
Previous ranking: 13
Points pace: 89. This pace has steadily decreased in the past two weeks, as the Avs have tried everything, including breaking up their heralded top line. The West is an absolute meat grinder, but I think the Avs can get back around that 95-point plateau. Over.
Previous ranking: 15
Points pace: 95. Middle of the pack in offense and defense, but not too reliant on one line to carry them. Claude Julien is a stealth Jack Adams candidate for squeezing as much juice out of this team as he has. Under.
Previous ranking: 17
Points pace: 88. It's a Bruce Boudreau team, which means it will ultimately exceed expectations and end up in a playoff spot even if it has no business being there. Over.
Previous ranking: 16
Points pace: 86. The Ducks have come back down to earth with the velocity of Skylab, as John Gibson's back strains from carrying the sixth-worst possession team and second-worst offensive team to the playoff bubble. We were right about Randy Carlyle, you guys. Under.
Previous ranking: 19
Points pace: 80. The Canucks are a team with some true offensive dynamos, but one that has trouble preventing both shot attempts and goals from opponents. This is, like, an 82-point team, but one that's at least going to be exciting to watch even as their playoff hopes fade. Over.
Postgame analysis and highlight show airing each night throughout the season from Barry Melrose and Linda Cohn. Watch on ESPN+
Previous ranking: 23
Points pace: 88. I refuse to believe that we're witnessing yet another season of incredible possession numbers that are submarined by either terrible goaltending or invisible offense. This year, it's the latter, as the Canes have a 7.3 shooting percentage, worst in the NHL. Ugh ... but they're better than 88 points. They have to be. Over.
Previous ranking: 22
Points pace: 82. Fun fact: Ken Hitchcock hasn't had a team finish with a points percentage lower than .625 since his final campaign with the Blue Jackets. It's going to happen this season, for sure, but the Oil are going to be better than 82 points in Peter Chiarelli's swan song. Over.
Previous ranking: 21
Points pace: 82. One of my chillier freezing cold takes is that the Panthers would be a 100-point team this season, which they most certainly will not be. Unless, of course, they go on some ridiculous winning streak, on which I've now dolloped a freezing cold take on top of a now-much-warmer take. Over.
Previous ranking: 20
Points pace: 80. This points pace doesn't take into account the roster pruning that most certainly will occur again at the trade deadline for the Rangers. Under.
Football is king in the Cotton State, but from Huntsville to Birmingham and, yes, Tuscaloosa, there are many puckheads to be found.
The drawback to a muscular posterior? It's tough to find a pair of jeans that will fit. Connor McDavid and other NHL stars chronicle the struggle.
Only two goalies have won the Hart Trophy as MVP this millennium. Here's why the Ducks goalie should be No. 3, plus updates on all the other award races.
Previous ranking: 26
Points pace: 76. If the Coyotes finish with 76 points, it will be the first six-point year-over-year improvement that ultimately feels like a downgrade. Over.
Previous ranking: 24
Points pace: 76. Wait: Are you saying we shouldn't expect a team with only two true finishers at forward and goaltending that's ranked 26th in save percentage will hit 97 points again? We still wager they get over 80. Over.
Previous ranking: 28
Points pace: 71. While doing as poorly as possible would behoove the Hawks in the long term, the fact is that this combination of prideful veterans and young players trying to earn their keep will be better than this current pace by season's end. Over.
Previous ranking: 25
Points pace: 71. This is right around where we expect the Wings to end up before a really, really interesting summer in Detroit when it comes to managerial decisions. Eh, we'll take the under for the sake of the draft. Under.
Previous ranking: 29
Points pace: 76. It's a lost season for the Blues, but one that'll see them beat this current pace. Perhaps via copious amounts of starts for Jordan Binnington over Jake Allen. Over.
Previous ranking: 31
Points pace: 69. Who ends up with more points: the Kings in the standings, or their leading scorer this season? In any case ... Under.
Previous ranking: 27
Points pace: 69. In the time it took you to read this, the Flyers just started five more goaltenders. Over.
Previous ranking: 30
Points pace: 67. Hey, great news, Colorado. Under.
"
25723980,"Bettman said the league has promised Seattle it will host All-Star weekend within its first seven seasons, with the team slated to begin play in 2021-22. Bettman also says Seattle will host the NHL draft, and that event will likely be awarded before the All-Star Game arrives.
We asked around at games and sports bars in Alabama and Tennessee to get answers from hockey fans living below the Mason-Dixon line.
Johnny Gaudreau, Amanda Kessel and Kaapo Kakko had big weeks, but the Blues goalie takes the prize.
""It doesn't mean we are going to wait seven years,"" Bettman said. ""We're going to be bringing league events here. This is where we want to be.""
Bettman's unexpected and informal announcement was part of his first visit to Seattle since the franchise was approved by the league's Board of Governors in early December. Bettman met with members of the ownership group, political leaders in the city, fans who have placed deposits on season tickets and reviewed the status of the massive renovation of the arena at Seattle Center where the team will play.
Seattle's ownership group has put up over $1.5 billion in expansion fees, upgrades to the building formerly known as KeyArena, and a state-of-the-art practice facility that is expected to open in time to host the first training camp.
""If you talk about in terms of kicking the tires, the tires are in great shape,"" Bettman said. ""We couldn't be more excited. When the board made the decision to come to Seattle, we knew it was the right decision, it would be a great decision and everything that has transpired has not only lived up to expectation but has exceeded our expectations.""
The franchise initially hoped to open for the 2020 season, but it is using the additional year to ensure the arena is operational well ahead of the team's home opener. It also gives the team more time to put together its hockey staff.
The team still doesn't have a name or color scheme. Bettman said the league would mostly stay out of the selection process, aside from working with the Seattle franchise in colors, trademarks and other logistical parts of the expansion name. Seattle team president and CEO Tod Leiweke said the goal is to have a name announced by the middle of 2019. The franchise will be taking major input from fans that have put deposits down on season tickets.
Leiweke said the team's goal is to have a portal launched within the next 60 days for season-ticket depositors to provide feedback and to inform them of the timeframe for decisions and announcements moving forward.
""If I have my way, their fingerprints are going to be all over this franchise. Certainly a team name, but they're going to help us build this,"" Leiweke said.
Some fans are hoping to see a return of the Seattle Metropolitans -- a historic name in Seattle, since the Metropolitans won the Stanley Cup in 1917. That name might be off the table, though, since the NHL has a division with that name.
Bettman was asked if that name can be ruled out.
""Viscerally, yes,"" he said, ""but I never say never to anything.""
"
25784759,"""They're running around corners, printing. That's what was happening,"" said Chris Foster, the NHL's director of digital business development.
The coaches wanted to innovate the process, and the league listened. The SAP-NHL Coaching Insights App will begin appearing on coaches' iPads located at the benches and in the dressing rooms -- which are currently used for video replays -- as early as February.
No more waiting for the printer to churn out stat sheets. The data will now arrive in the hands of coaches as the game is going on, in real time. No more waiting until intermission to analyze the numbers; now, coaches can make informed adjustments to everything, from faceoff choices to ice time, on the fly.
""This will provide real-time data, analytics and metrics to complement the video and give them what they want in the live game environment,"" Dave Lehanski, the NHL's senior VP of business development and innovation, told ESPN. ""As far as we know, we'll be the only sports property delivering real-time video and data to the benches for the coaches and the players.""
In 2017, the NHL and Apple partnered to build an in-arena, in-game coaching system that allowed teams to review video highlights during the game. The request was made by players and coaches, and the system was well-received.
Over time, coaches began asking about adding real-time stats to the iPads. So the NHL, Apple and SAP began collaborating with bench coaches, video coaches and team analytics analysts to determine what data they'd need during the game to better make decisions, and how best to deliver it. The result is a clean interface that brings the real-time stats found on the league's website during games, as well as exclusive features, into the hands of coaches during play.
ESPN got a glimpse of the app this week, which will be loaded onto new iPad Pro tablets for the teams. (These tablets, by the way, are restricted for use in the arena only, because of security concerns.) It allows teams to monitor any number of stats, from broad categories like shot attempts to narrower ones like faceoff success in certain areas of the ice and against certain opponents. Coaches can dial up which type of shot their players have used in a shootout the most, and what type of goals their netminders have surrendered.
Each data category is customizable, so coaches can specify which stats they're most interested in tracking. But there's also player customization: Coaches can set a particular ice time target for a skater, and then receive data on how close to that target a player is after each shift.
""There are two stat types across the board that every coaching staff said that, without question, helped them make in-game moment decisions: Time on ice and faceoffs,"" Foster said. ""With time on ice, you want to manage your top players to make sure they have gas in the tank at the end of the game, or if they're coming back from an injury.""
For both ice time and faceoffs, the app offers something that the coaches uniformly requested from the NHL: easy-to-read displays. Faceoff success or failure is depicted as a series of green circles with check marks or red circles with X's, and faceoff percentages can be broken down by where they were held and against whom.
""While coaches consider season performance or career performance, it's what they're doing in that game that matters,"" said Foster.
Players that are near or over their ice time projection during the game will have their names displayed in red, with a small red triangle with an exclamation point next to their photo -- similar to a ""check engine"" light on a car dashboard.
There's also the ability to map shots on goal for different situations, locations and specific players, with real-time data on the results of those shot attempts. But that information is the tip of the massive iceberg slowly moving the NHL into the future. Puck and player tracking technology is in its final testing stages, and NHL commissioner Gary Bettman expects that it will be used by teams and on broadcasts beginning next season.
While the SAP-NHL Coaching Insights App will help coaches for the rest of this season, Foster admits this is only Version 1.0 of what's to come with the data dump of player tracking tech. By next season, coaches could use it to track everything from the distances their players have skated to the velocity and placement of their shots each period.
""If the demand [for this] isn't there right now, it'll definitely be there when player and puck tracking arrives,"" he said.
"
25717035,"The team put Steen on injured reserve Tuesday before hosting the Dallas Stars. Steen injured his left shoulder on an open-ice hit from Flyers defenseman Radko Gudas in the first period Monday night in Philadelphia.
Steen has six goals and nine assists for 15 points in 32 games this season. The 34-year-old Swede is in his 10th full season with St. Louis and is a veteran of 930 regular-season NHL games with the Blues and Toronto Maple Leafs.
"
25736241,"""Due to unresolved issues/symptoms from the concussion sustained last March, Rick Nash will be forced to retire from the game of hockey. Under the advice of his medical team, the risk of further brain injury is far too great if Rick returns to play,"" his agent Joe Resnick said in a statement. ""Rick would like to thank everyone who has supported him during this difficult time period.""
Nash was drafted first overall in 2002 by the Columbus Blue Jackets. Playing for the Blue Jackets, New York Rangers and Boston Bruins, Nash had 437 goals and 368 assists in 1,060 career games. Until his retirement, Nash was third among active NHL players in goals scored, ranking behind Alex Ovechkin and Patrick Marleau. He led the NHL with 41 goals in 2003-04 and was a six-time All-Star.
He suffered several reported concussions during his NHL career, most recently in March as a member of the Bruins. He missed six weeks with concussion symptoms in 2013 while with the Rangers.
Nash was an unrestricted free agent after completing an eight-year, $62.4 million deal originally signed with Columbus. He was involved in two high-profile trades in his career: the six-player blockbuster in July 2012 that brought him from Columbus to New York and the February 2018 deadline trade that saw the Bruins rent him before free agency from the Rangers.
He was a franchise star with the Blue Jackets, but his tenure with the Rangers had its peaks and valleys, particularly due to inconsistency in the postseason, where Nash had 14 goals in 73 games. While with the Bruins, Nash had three goals and three assists in 11 regular-season games and three goals and two assists in 12 playoff games.
But after the season, Nash informed teams that he would not entertain offers as a free-agent forward, instead taking time to decide on his future.
""Rick has the utmost ethics and integrity,"" Resnick told ESPN. ""We turned down a lot of money. Let's put it that way.""
There had been speculation that Nash would sit out the summer free-agency frenzy and return to the NHL later in the season, perhaps when there was more clarity on which teams were contending for the Stanley Cup. Resnick denied that was the case last summer.
In the end, the decision was to choose long-term health over a return to the ice.
"
25737718,"The Predators' Austin Watson, whose suspension for domestic violence was reduced to 18 games by an arbitrator in October, is eligible to return Thursday vs. Arizona.
Watson said Friday in an Instagram post that he's been dealing with anxiety, depression and alcoholism since the age of 18. Watson said he entered the NHL's substance abuse program after his June 16 arrest and added that ""I am currently sober and committed to living a healthy lifestyle so that I can be the father, partner, teammate and person I want to be.""
Watson pleaded no contest July 24 to domestic assault and agreed to a judicial diversion program.
His girlfriend, Jenn Guardino, issued a statement in October taking blame for the incident and saying Watson would never hit or abuse her.
"
25746621,"The stick of Cam Atkinson slid through the goalie mask as Holtby raised it to prepare to deflect a potential shot, and the stick appeared to make contact with Holtby near his eyes.
Holtby was treated on the bench before heading to the locker room. The Capitals announced during the second intermission that he would not return to the game.
Coach Todd Reirden was ""very concerned'' and remained uncertain about Holtby's status afterward.
""He'll be getting evaluated later tonight still,'' Reirden said. ""Our initial discussions with our trainer and doctors, that's a serious thing. He wasn't able to return to the game, and we'll get some more evaluation tonight and know a little bit more tomorrow and have a better update for you guys then.''
Pheonix Copley replaced Holtby in net and stopped the first 10 shots he faced before allowing a power-play goal to Artemi Panarin 3:30 into overtime.
Atkinson, who scored earlier in the game, received a two-minute penalty for high sticking.
The Capitals had already gotten a scare when Alex Ovechkin left the game in the first period, but the NHL's leading goal-scorer came back for the second. Reirden said Ovechkin needed medical attention to close a cut on one of his hands.
The Associated Press contributed to this report. 
"
25713702,"Kessel set a Riveters franchise record by recording five points in their 6-3 win over the Connecticut Whale on Sunday. All five points were assists, with four of them primary assists. Only two other players in NWHL history -- Kessel's U.S. national teammates Brianna Decker and Meghan Duggan -- have previously recorded five points in a game.
The diminutive dynamo had five goals and 11 points overall in four games last week, helping the Flames to a 3-1-0 record. That included two straight four-point games, becoming only the third player in franchise history to do that and the first since Doug Gilmour did it 30 years ago (!) in 1988. Gaudreau was the NHL's second star of the month in December and the first star for the first week in January. The best player in the NHL who may or may not be able to fit inside his own suitcase.
Kaliyev had 11 points in four games, including seven goals, for the Bulldogs. And he did it without the benefit of a hat trick: two goals, one goal, two goals and two goals. Kaliyev, 17, is a native of Staten Island, New York, which has produced such notable names as Nick Fotiu and Zach Aston-Reese.
A Reddit user posted this inspiring video that P.K. Subban created for the man's son, Ty Cornett, a youth hockey player in the Metro Detroit area:
This is cool from PK Subban (with sound -- sent encouraging message to a 13-yo hockey player who's been dealing with racist taunts) pic.twitter.com/JF9H7mMnIR
- Kaelen Jones (@kaelenjones) January 7, 2019
""This year has been tough. My son is very aggressive and loud, so that brings out the trash talk. I have no problem with trash talking at all (part of the sport), but the racist talk needs to stop. Between the N-word being thrown at him over and over, being called monkey by players and parents, having an entire team beat their chests and act like gorillas whenever he touched the puck, and being told he should be lynched by former teammates,"" wrote the poster.
As you can hear, Subban sent a video of encouragement -- and Ty has watched it ""over 500 times."" Just another reminder that the hockey community will rally together to fight back against this kind of unconscionable ugliness.
It took everything I possess deep in my soul as an American hockey fan to put Kakko on this list. But alas, he earned it. He scored the game-winning goal with 1:26 remaining in regulation to lead the Finns to World Junior gold over the U.S., and in the process might have converted some non-believers into considering him for first overall pick in next June's NHL draft. Congrats to Kakko ... but another player was the best of the week.
And the best player in the world of the week is ...
Now, who is Jordan Binnington?
Last week, he was the goaltender for the AHL San Antonio Rampage. In fact, he earned that league's first star of the week honors for allowing one goal on 63 shots during two victories for the Rampage. That's a .984 save percentage, including a shutout at the Chicago Wolves, something no other AHL goalie has done in nearly two years.
But it gets better. Binnington was recalled by the Blues, the Rampage's parent club, on Saturday, and got his first NHL start on Monday in hostile territory: on the road, at the Philadelphia Flyers. It was just his fourth NHL appearance.
With his dad, John, and his stepmother, Pam, in attendance, the 25-year-old native of Richmond Hill, Ontario, made 25 saves for his first NHL victory and shutout.
""I think I was a little bit nervous, but at the same time calm and just tried to focus on my job and just stop the puck,"" he said. ""Go save by save, minute by minute and just enjoy the experience, and before I knew it, the game was over.""
Also over: this week. And Jordan Binnington was the best player from it. Congratulations!
"
