25715600,"The defenseman recorded a video and texted it last week to Ty Cornett, a 13-year-old Detroit-area hockey player.
Cornett's father, Matthew Cornett, shared the video, which was recorded in Detroit during the Predators' visit to the city last week, on Reddit.
""I can tell you this right now: As long as you're still breathing in this world, you've got to believe in yourself and let nobody tell you what you can and can't do. Especially if it's because of the color of your skin,"" said Subban, who is black and was born in Toronto and previously starred with the Montreal Canadiens.
""In this world, some things happen that we don't really understand. That's OK. We don't have to understand them. All we need to do is understand ourselves, believe in ourselves, keep trying and keep pushing forward.
""I just want to tell you that when you're playing hockey, you play because you love the game and you want to play. Let nobody take that away from you.""
Matthew Cornett says Ty had asked for a Subban Canadiens jersey when he was 6 and wears the same No. 76 as the player.
""This year has been tough,"" Matthew Cornett wrote. ""My son is very aggressive and loud, so that brings out the trash talk. I have no problem with trash talking at all (part of the sport), but the racist talk needs to stop. Between the N-word being thrown at him over and over, being called monkey by players and parents, having an entire team beat their chests and act like gorillas whenever he touched the puck.
""This video meant more to my family than anything. I think my son has watched it over 500 times (no joke).""
"
2572430,"How we rank: We use a panel of voters, and these rankings reflect which teams voters think would win head-to-head matchups. Higher-ranked teams are favored over lower-ranked teams. A run of wins doesn't guarantee a jump, and a couple of losses doesn't guarantee a fall.
Previous ranking: 1
Points pace: 130. The Lightning are on pace for the best regular season since the Red Wings amassed 131 points in 1995-96. They're a full-on juggernaut, but there's a reason no one has cracked 130 points in 23 years. Under.
Previous ranking: 2
Points pace: 109. The Leafs were a 105-point team last season, so this mark is very much in reach. As long as goaltender Frederik Andersen remains steady (and healthy), this team will hit 110 points or better. Over.
Previous ranking: 5
Points pace: 109. The Flames are for real, and that plus-31 goal differential isn't just a product of better-than-expected goaltending. (And a .902 save percentage is ahead of where we thought they'd be.) Getting to 108 points in the wacky West is a tall order, but they're 100 percent a 100-point team. Under.
Football is king in the Cotton State, but from Huntsville to Birmingham and, yes, Tuscaloosa, there are many puckheads to be found.
The drawback to a muscular posterior? It's tough to find a pair of jeans that will fit. Connor McDavid and other NHL stars chronicle the struggle.
Only two goalies have won the Hart Trophy as MVP this millennium. Here's why the Ducks goalie should be No. 3, plus updates on all the other award races.
Previous ranking: 8
Points pace: 104. Due respect to the Sharks' recent roll and the return of Erik Karlsson to public adulation, but I can't trust a team with a .893 save percentage to stay on this pace. However, it's a playoff team, for sure. Under.
Previous ranking: 6
Points pace: 104. The Predators were a 117-point team last season, and this current pace comes after three months of significant injuries to top players like Filip Forsberg and P.K. Subban. A fully armed and operational Predators team will power past this current pace. Over.
Previous ranking: 4
Points pace: 109. This would be ahead of where the Capitals finished last season. As Alex Ovechkin showed with his All-Star Game decision, Washington knows that slow and steady can win the race again. Under.
Previous ranking: 3
Points pace: 109. The Jets are at this pace with Connor Hellebuyck playing to a .909 save percentage and Patrik Laine with one goal since Dec. 16. Those trends are going to reverse, and GM Kevin Cheveldayoff is going to pull off another Paul Stastny-esque move at the deadline. Over.
This week's episode makes some ESPN On Ice history. To incorporate the voice of the listener, Greg Wyshynski and Emily Kaplan opened up the phone lines to field great hockey questions from our loyal fan base. Plus, find out if we get stumped by this week's ""Sach Got Your Number."" And Linda Cohn advises what the New York Rangers should do in the way of future front-office moves. Listen »
Previous ranking: 9
Points pace: 103. The Knights are probably a team that lands at around 100 points, but if there's anything we've learned in the past year, it's to not bet against Vegas. Over.
Previous ranking: 10
Points pace: 103. The goaltending has figured itself out, Sidney Crosby is playing at an MVP level and they're on an 11-2-0 roll. To quote an ancient ad campaign for an adult beverage: Beware of the Penguins. Over.
Previous ranking: 7
Points pace: 103. The Bruins and Leafs will flip-flop in the standings, with Toronto getting the No. 2 seed and home ice and Boston getting right around 103 points. Conservatively, we'll say they're just a shade below it. Under.
Previous ranking: 11
Points pace: 100. The teams chasing the top three in the Metropolitan are starting to close the gap a bit. We're a little worried about what GM Jarmo Kekalainen does with Artemi Panarin and Sergei Bobrovsky. The Jackets have been a 100-point team only once in franchise history. John Tortorella has hit that number only three times in 14 full seasons as an NHL coach. Under.
Previous ranking: 14
Points pace: 100. The Islanders are riding the PDO train this season (102.82 in combined shooting and save percentages). They're an amazing story, and they could very well be a playoff team, but they're probably also crossing the finish line with double-digit points. Under.
Catch more than 180 NHL games streaming live this season on ESPN+. Click here for the upcoming schedule and to learn how to subscribe.
Previous ranking: 12
Points pace: 99. Are the Sabres going to have a 37-point improvement from last season? No. But they're going to have a 30-plus-point improvement, which is nothing to be ashamed of. Under.
Previous ranking: 18
Points pace: 93. If team president Jim Lites can savage his best players in profanity-laced tirades to the media every month or so, they're money. (Also, it'll be a big help if Ben Bishop keeps doing what he's been doing.) Over.
Previous ranking: 13
Points pace: 89. This pace has steadily decreased in the past two weeks, as the Avs have tried everything, including breaking up their heralded top line. The West is an absolute meat grinder, but I think the Avs can get back around that 95-point plateau. Over.
Previous ranking: 15
Points pace: 95. Middle of the pack in offense and defense, but not too reliant on one line to carry them. Claude Julien is a stealth Jack Adams candidate for squeezing as much juice out of this team as he has. Under.
Previous ranking: 17
Points pace: 88. It's a Bruce Boudreau team, which means it will ultimately exceed expectations and end up in a playoff spot even if it has no business being there. Over.
Previous ranking: 16
Points pace: 86. The Ducks have come back down to earth with the velocity of Skylab, as John Gibson's back strains from carrying the sixth-worst possession team and second-worst offensive team to the playoff bubble. We were right about Randy Carlyle, you guys. Under.
Previous ranking: 19
Points pace: 80. The Canucks are a team with some true offensive dynamos, but one that has trouble preventing both shot attempts and goals from opponents. This is, like, an 82-point team, but one that's at least going to be exciting to watch even as their playoff hopes fade. Over.
Postgame analysis and highlight show airing each night throughout the season from Barry Melrose and Linda Cohn. Watch on ESPN+
Previous ranking: 23
Points pace: 88. I refuse to believe that we're witnessing yet another season of incredible possession numbers that are submarined by either terrible goaltending or invisible offense. This year, it's the latter, as the Canes have a 7.3 shooting percentage, worst in the NHL. Ugh ... but they're better than 88 points. They have to be. Over.
Previous ranking: 22
Points pace: 82. Fun fact: Ken Hitchcock hasn't had a team finish with a points percentage lower than .625 since his final campaign with the Blue Jackets. It's going to happen this season, for sure, but the Oil are going to be better than 82 points in Peter Chiarelli's swan song. Over.
Previous ranking: 21
Points pace: 82. One of my chillier freezing cold takes is that the Panthers would be a 100-point team this season, which they most certainly will not be. Unless, of course, they go on some ridiculous winning streak, on which I've now dolloped a freezing cold take on top of a now-much-warmer take. Over.
Previous ranking: 20
Points pace: 80. This points pace doesn't take into account the roster pruning that most certainly will occur again at the trade deadline for the Rangers. Under.
Football is king in the Cotton State, but from Huntsville to Birmingham and, yes, Tuscaloosa, there are many puckheads to be found.
The drawback to a muscular posterior? It's tough to find a pair of jeans that will fit. Connor McDavid and other NHL stars chronicle the struggle.
Only two goalies have won the Hart Trophy as MVP this millennium. Here's why the Ducks goalie should be No. 3, plus updates on all the other award races.
Previous ranking: 26
Points pace: 76. If the Coyotes finish with 76 points, it will be the first six-point year-over-year improvement that ultimately feels like a downgrade. Over.
Previous ranking: 24
Points pace: 76. Wait: Are you saying we shouldn't expect a team with only two true finishers at forward and goaltending that's ranked 26th in save percentage will hit 97 points again? We still wager they get over 80. Over.
Previous ranking: 28
Points pace: 71. While doing as poorly as possible would behoove the Hawks in the long term, the fact is that this combination of prideful veterans and young players trying to earn their keep will be better than this current pace by season's end. Over.
Previous ranking: 25
Points pace: 71. This is right around where we expect the Wings to end up before a really, really interesting summer in Detroit when it comes to managerial decisions. Eh, we'll take the under for the sake of the draft. Under.
Previous ranking: 29
Points pace: 76. It's a lost season for the Blues, but one that'll see them beat this current pace. Perhaps via copious amounts of starts for Jordan Binnington over Jake Allen. Over.
Previous ranking: 31
Points pace: 69. Who ends up with more points: the Kings in the standings, or their leading scorer this season? In any case ... Under.
Previous ranking: 27
Points pace: 69. In the time it took you to read this, the Flyers just started five more goaltenders. Over.
Previous ranking: 30
Points pace: 67. Hey, great news, Colorado. Under.
"
25729934,"Adidas partnered with the environmental group Parley for the Oceans to create jerseys made out of upcycled marine plastic debris. The waste is made into technical fibers and then woven into a breathable fabric.
⚫️⚪️⚫️⚪️⚫️⚪️ Can't get enough of the new @adidashockey x @parleyxxx jerseys for the 2019 #NHLAllStar Game, transforming harmful plastics into high performance sportswear! #adidasParley #adizero pic.twitter.com/gbxAMnpsry
Adidas has also made a uniform out of the same material for the Miami Hurricanes football team.
""The NHL is a recognized leader in addressing major environmental challenges and preserving the roots of our game,"" Brian Jennings, NHL chief branding officer and executive vice president, said. ""Adidas has been an incredible partner in our efforts and shares our commitment to promoting sustainable business practices. Each year, the NHL All-Star Weekend serves as an opportunity to showcase innovations across all aspects of our game.""
The predominantly black and white uniforms will also for the first time feature the team logos of the players on the front instead of an NHL shield and conference logo.
The All-Star skills competition is Jan. 25 in San Jose, California, with the four-team All-Star tournament taking place the next day.
"
25769234,"Our current leader for the Norris Trophy had himself a week for the first-place Flames. Giordano had three goals and five assists in four games to help the Flames to a perfect week. That included a three-assist game in a win over the Avalanche. He also played in his 800th game in the NHL, celebrating with two goals and an assist in a win over the Coyotes.
Jürgens is an 18-year-old winger from Estonia who also plays for the Jukurit in the SM-Liiga. Here he is with your normal, everyday, between-the-legs-and-back-again deke into a backhand shootout goal:
Morten Jürgens are you freaking kidding me? Unreal shootout goal. pic.twitter.com/znDsVneYnJ
- Alex Nunn (@aj_ranger) January 14, 2019
Two minutes for cruelty to the goaltender on that one.
After failing to make the Panthers' roster in 2017, the veteran has become an electrifying goal-scoring force for the Golden Knights this season.
One great line doesn't make a Stanley Cup champion -- but it certainly doesn't hurt. We debate the top trios around the league.
Some NHL teams have two great goalies. For some, the backup is outplaying the starter. And then there are the Flyers. Here's our rundown of all 31 teams.
In three games this month, the 20-year-old Red Deer native has five goals and five assists, which is impressive. But here's ""impressive"" redefined: Vandervlis was in a medically induced coma last August after a freak campfire accident burned 50 percent of his body. He played in the WHL last season; after the accident, it was assumed he'd never play again. But Vandervlis wouldn't be denied, fighting back to play the sport that he loves.
""They said it'll take upwards of two years to fully mature and heal. My scars are pretty young still, but my body is capable of playing at this level, so that's what I'm doing,"" he told Lethbridge Now. (s/t reader Byron Hackett)
Hey, remember Sam Carrick? Well, he's playing for the Anaheim Ducks' affiliate after getting in three games for them this season. He tore it up last week: back-to-back three-point games for the Gulls, with two goals and four assists.
San Diego has won eight games in a row. Sounds like they have pretty good coach down there, with NHL experience, and probably ready for another shot at the show. If only there were a team in the same state that might need a new coach in short order...
Sometimes, our nominees don't have to do anything spectacular on the ice to merit a mention here. Such is the case with Moritz Müller, a 32-year-old German defenseman. Oh, he's an accomplished player, to be sure: Captain of the Kölner Haie of the Deutsche Eishockey Liga and a member of Germany's silver medal-winning Olympic men's hockey team in 2018. But the reason we're spotlighting him here is because he stood up for his sport.
On Saturday, the DEL Winter Game was held in Cologne between Kölner Haie and Düsseldorfer EG. These are long-standing rivals, and they played in a soccer stadium in front of 54,000 fans, and it was awesome.
Topwerte für das #DELWINTERGAME2019 mit @Koelner_Haie_72 vs @DuesseldorferEG @SPORT1: 230.000 Zuschauer im Schnitt & 340.000 in der Spitze waren bei der Übertragung am Samstag mit @SBanderm, @BastiSchwele & @RickGoldmann dabei. Dazu starke Marktanteile von 2,8% (M14-59) und 1,2% pic.twitter.com/CGfOKuGup7
- SPORT1 PR (@SPORT1_PR) January 14, 2019
Alas, despite all that fanfare, it wasn't covered at all on the nation's biggest Saturday night sports show, Aktuellen Sportstudio. Which didn't set well with Müller. He took to Facebook and Instagram and blasted the show, calling it ""Soccer Studio"" and slamming it for covering that sport more during its Winter Break than it did this hockey game.
Their meek response to his critique? That the hockey news didn't make the cut due to some ""technical difficulties.""
Full marks to Moritz Müller for standing up for his sport. (s/t to Simon Wittke for the nomination.)
She didn't see the ice during the game, but Keast made history in the Saskatchewan Junior Hockey League. The 17-year-old served as a backup goalie for the Ice Wolves on an emergency basis, and league officials believe she broke the SJHL's bender barrier. The team had traded away a goalie and the one they acquired as a replacement wasn't going to make the game in time. So Keast stepped in, having been mentioned by a local midget hockey coach. She took warmups, but didn't play.
""It was good. I was really nervous,"" she said. ""So my movements were off a bit. But it was still a pretty cool experience."" (s/t to Chris Clark)
And the best player in the world of the week is ...
Now, who is Patrick Doyle?
He's a star for St. Ignatius College Prep in the Chicago Catholic Hockey League, which hasn't had a team win the Illinois state championship since 2012. But Doyle and the Wolfpack are 28-4-2, and might give the league its best shot at one in some time.
Speaking of shots, that's why Doyle is our honored player of the week. He's had a great season, with 26 goals and eight assists heading into this weekend's games. He's never been better than he was against the Benet Academy Redwings on Sunday, the team right behind St. Ignatius in the standings (and the alma mater of his father). Doyle had a hat trick, and his final goal of the trick came as the buzzer sounded -- in overtime!
A huge 5-4 OT W against @BenetHkyVarsity. MVP of the game- Pat Doyle with the hat-trick and the buzzer beater game winning goal. The boys are back this weekend with the Jesuit Cup. Go Pack! pic.twitter.com/UNRO8NpG0Q
- St. Ignatius Hockey (@SICPBoysHockey) January 14, 2019
I mean, c'mon, we get how many buzzer-beaters in a hockey year? Three, maybe? And this one was such a stunner that no one even remembered to throw a hat for Doyle.
The senior is chasing a scoring title for St. Ignatius this season, which is something no one on the team assumed he could before this season. Because, as it turns out, he wasn't on the team.
As reader Andrew Weiss of Northwestern University, who nominated Doyle, writes: ""Doyle made a decision over the summer to attend Northfield Mount Hermon High School in Massachusetts, a big hockey prep school in the Northeast. Right before the hockey season started, Doyle elected to come back and play his senior year with St. Ignatius, a team with his close friends and his younger brother Sean.""
The Wolfpack certainly are happy he made that call.
For an incredible moment and an incredible season, Patrick Doyle is the Best Player In The World Of The Week.
"
25779527,"How we rank: We use a panel of voters, and these rankings reflect which teams voters think would win head-to-head matchups. Higher-ranked teams are favored over lower-ranked teams. A run of wins doesn't guarantee a jump, and a couple of losses doesn't guarantee a fall.
Note: All stats are accurate through games of Jan. 16.
Previous ranking: 1
If the Lightning win the Cup with their current group, they will be the first team since the 1988-89 Flames to not have a previous Cup winner on the roster.
Previous ranking: 3
Three different Flames -- Sean Monahan, Johnny Gaudreau and Mark Giordano -- have been named the NHL's First Star of the Week, the most of any team.
We start this episode by reviewing Emily Kaplan's piece on ""Hockey Butts,"" which drew reaction from around the sports world. Former NHL goaltender Marty Biron weighs in on the Sabres' struggles, including the future of Jeff Skinner in Buffalo (14:12). Rangers defenseman Marc Staal joins to talk about his family's NHL success, as well as his future in New York (33:00).  Listen »
Previous ranking: 5
Want to silence the crowd? The Predators have scored six empty-net goals on the road, most in the NHL.
Previous ranking: 4
Sharks forward Evander Kane leads the NHL with 26 penalties committed. Despite this, the Sharks have spent the eighth-fewest minutes on the penalty kill.
Previous ranking: 7
The Jets lead the league with 12 first-round picks on their roster, led by 2016 second overall pick Patrik Laine.
Previous ranking: 2
The Maple Leafs have attempted 1,423 shots, which ranks 18th in the league, but have missed the net the most often (612 times), shooting wide on 43 percent of those shots.
The NHL trade season is underway. Get caught up on the assets, restrictions and potential moves for every team ahead of the Feb. 25 deadline.
Mark Giordano bolstered his Norris Trophy case. Morten Jürgens wowed us with a shootout move. But the St. Ignatius College Prep star takes the prize.
One great line doesn't make a Stanley Cup champion -- but it certainly doesn't hurt. We debate the top trios around the league.
Previous ranking: 8
Goalie Marc-Andre Fleury leads the league in wins. At age 35, he could finish the season as the oldest leader since Martin Brodeur at age 37 in 2009-10.
Previous ranking: 6
The Capitals have had 235 minutes of power-play time this season, and Alex Ovechkin has been on the ice for 88.5 percent of that (208 minutes, 46 seconds) -- the highest percentage in the league.
Previous ranking: 9
Don't look away when this team gets the man advantage. The Penguins have the No. 5 power-play rate (25.8 percent) but have also surrendered the most short-handed goals (10).
Previous ranking: 11
The Blue Jackets are the youngest team in the league despite having only one rookie on the active roster, center Kevin Stenlund.
Catch more than 180 NHL games streaming live this season on ESPN+. Click here for the upcoming schedule and to learn how to subscribe.
Previous ranking: 10
Has the local pro team taken a side in a collegiate rivalry? Boston College and Boston University have both produced 18 active NHLers, but the Bruins feature three former BU Terriers and no former BC Eagles.
Previous ranking: 12
Is this Canada's team? The Islanders have the most Canadian provinces (seven) represented on their active roster.
Previous ranking: 16
The Canadiens have had 20 lefty-shooting players appear for the team this season, most in the league.
Previous ranking: 14
Before CEO Jim Lites' profane comments, the Stars had a shooting percentage of 9.0 percent and averaged 2.7 goals per game. After the comments, those fell to 6.7 percent and 2.2 goals per game.
Previous ranking: 13
Before the 10-game winning streak Buffalo went on in November, the team's previous 10-game streak was in 2006-07. Jason Pominville was there for both.
Previous ranking: 15
Nathan MacKinnon has been on the ice for 94 goals by his team, most in the NHL among forwards.
Postgame analysis and highlight show airing each night throughout the season from Barry Melrose and Linda Cohn. Watch on ESPN+
Previous ranking: 17
There are 721 wild animal species native to Minnesota, 20 higher than the combined number of wins (regular season plus playoffs) in franchise history.
Previous ranking: 19
Elias Pettersson is tied for the league lead in game-winning goals (seven). No rookie has ever led the NHL in that category in the modern era.
Previous ranking: 20
The Hurricanes have committed the fewest dollars in the league toward their forward group yet still lead the NHL in shots per game.
Previous ranking: 21
The Oilers are 6-9-1 against Pacific Division foes, the second-worst record of any team against its own division. They are 16-12-2 against everyone else. Prorate that ""everyone else"" record over 82 games, and they'd be a 93-point team.
Previous ranking: 28
The Blues have the heaviest roster in the league, with an average of 204 pounds, and the fifth-tallest roster, with an average height of 6-foot-1.
Previous ranking: 18
Thirty-one players have suited up for the Ducks this season, most for any team in the league.
Previous ranking: 23
The Rangers have participated in 15 fights, second most in the NHL, led by forward Cody McLeod, who's tied for the league lead with five.
The NHL trade season is underway. Get caught up on the assets, restrictions and potential moves for every team ahead of the Feb. 25 deadline.
Mark Giordano bolstered his Norris Trophy case. Morten Jürgens wowed us with a shootout move. But the St. Ignatius College Prep star takes the prize.
One great line doesn't make a Stanley Cup champion -- but it certainly doesn't hurt. We debate the top trios around the league.
Previous ranking: 24
Opponents might be wishing they could just decline penalties. In addition to having the NHL's best penalty kill (88.7 percent), the Coyotes lead the league in short-handed goals (14).
Previous ranking: 25
The Devils and the Jets are the only two teams this season to win a game in five different time zones.
Previous ranking: 22
The Panthers have the worst winning percentage this season when scoring first, at .350.
Previous ranking: 27
The Red Wings have spent 52 minutes, 35 seconds more on the penalty kill (253:32) than on the power play (200:57), the worst differential in the league.
Previous ranking: 26
The Blackhawks' roster has eight nationalities represented, tied with the Blue Jackets for most in the NHL.
Previous ranking: 30
The Flyers recently picked up all-time regular-season win No. 1,993. That was also a notable year, as it was Eric Lindros' first full season with the Flyers, and the year current blueliner Shayne Gostisbehere was born.
Previous ranking: 29
The Kings feature a member of the 2011-12 Devils (Ilya Kovalchuk) and the 2013-14 Rangers (Carl Hagelin), the two teams they defeated to win the Stanley Cup.
Previous ranking: 31
Thirty players drafted by the Senators were active in the NHL this season, the most of any team's draft picks. Unfortunately, 14 of them play for other teams.
"
