2570754,"All of that training, however, came with a sacrifice: He didn't work his butt off at all. Actually, his lower half became too big to fit into most pants.
""Can it be hard for me to find pants? Yes, always,"" McDavid says. ""The waist, you need to get around your thighs and butt, but that doesn't always match how tall you are. I definitely have a hard time finding jeans that fit.""
He's hardly alone. ""I have had trouble,"" Dallas Stars captain Jamie Benn says. ""I just need to find the right company. Jeans are the hardest.""
This week's episode makes some ESPN On Ice history. To incorporate the voice of the listener, Greg Wyshynski and Emily Kaplan opened up the phone lines to field great hockey questions from our loyal fan base. Plus, find out if we get stumped by this week's ""Sach Got Your Number."" And Linda Cohn advises what the New York Rangers should do in the way of future front-office moves. Listen »
Penguins forward Zach Aston-Reese forgot to bring jeans on a road trip earlier this season. So while the team was in Ottawa, Aston-Reese ventured to the Levi's store. That's when he received a call from teammate Derek Grant. ""Are you still shopping?"" Grant asked. ""Can you buy me a pair?""
""Sure,"" Aston-Reese said. ""What size?""
""34,"" Grant said.
""No way!"" Aston-Reese replied.
Aston-Reese is technically a 34 waist himself, but he always buys a size 36 ""because my butt won't fit in a 34,"" he says. ""Derek is bigger than me,"" Aston-Reese adds. ""So there we are, having an argument in the Levi's store, because I was sure I was right.""
Several NHL players express their struggles with finding a pair of jeans that fits properly.
Not everyone fits into the same exact mold, making the sweet spot for size unique for every player.
""I've never really talked about it,"" Blackhawks captain Jonathan Toews says. ""But it's definitely a thing a lot of guys go through.""
""It's an absolute nightmare between the quads and the glutes,"" Montreal Canadiens center Max Domi says. ""The glutes especially, because it just throws off your waist. You have, like, a 48 waist with your ass, but without it, you're a 32. So what do you do? Meet halfway, and you still have all this extra stuff.""
New York Islanders winger Anders Lee often goes to the mall with his wife. ""I'll try on, like, 40 pairs of pants or jeans,"" he laments, ""and we'll walk away with one ... or none. Oh, and anything that says 'skinny'? Trust me, I'm not getting into that.""
Postgame analysis and highlight show airing each night throughout the season from Barry Melrose and Linda Cohn. Watch on ESPN+
Last month, Blackhawks defenseman Connor Murphy spent an off day at Bloomingdale's. He tried on about 10 pairs of jeans and none of them fit. ""I got so mad, I hate shopping,"" Murphy says. ""But the saleswoman was really helpful and spent a lot of time with me, so I literally bought a pair because I felt bad for her -- even though they didn't fit and I knew I was going to return them later. I just had guilt.""
""There's definitely some pants I can't really fit into,"" says reigning league MVP Taylor Hall of the Devils. ""Some shorts that maybe fit my waist but don't fit the other parts. It's a challenge. You want to have big legs in hockey. You want to be a guy who skates well and uses his power, for sure. But that means ...""
We'll finish Hall's thought: If your body makes you good at your job, it provides bad luck in the dressing room (of a department store, that is).
This might be a new phenomenon, coinciding with the evolution of hockey players' training and, therefore, their physiques. Domenico Vacca is the personal tailor to upward of 250 NHL players and some coaches. Since the 1980s, he has been flying around North America creating custom suits cut from his own fabric for some of the game's biggest stars.
""It's a lot different now than it used to be,"" Vacca says. ""When I started, it was all about the upper body. The upper body was very big. Now, maybe six or seven years ago, I noticed the guys are all bigger in the thighs.""
This make's Vacca's job especially important because the trend now is a tapered look. In the '90s, players would have a baggy 27 inches around the knee. Now it's more like 17 or 18.
Finding the right tailor is one way to go. Before Pittsburgh Penguins defenseman Jack Johnson discovered his brand of choice, Banana Republic, he says he would buy pants with ""a waist so big that they'd get over my thighs, then get them tailored to the point where my back pockets were, like, touching. It looked ridiculous.""
Football is king in the Cotton State, but from Huntsville to Birmingham and, yes, Tuscaloosa, there are many puckheads to be found.
The star winger has his Flames in first place, and he's on pace to shatter his previous career highs. We check in with the New Jersey native.
Only two goalies have won the Hart Trophy as MVP this millennium. Here's why the Ducks goalie should be No. 3, plus updates on all the other award races.
As for the larger-thigh phenomenon, it becomes more pronounced once a player gets to the NHL. For example, Vacca outfitted one player for the NHL draft in 2014. He recently visited that player to get him fitted for a new suit. ""His upper body is the same, almost exactly the same measurements at the top,"" Vacca says. ""His thighs were up an inch, and his hips were up two-and-a-half inches.""
Of course, this doesn't apply to everyone. If you've ever stood next to Vegas Golden Knights goaltender Marc-Andre Fleury, you'll notice he's quite tall (6-foot-2) but slight. ""I am fine buying pants,"" he says. ""No problem.""
Goalies have different needs. As for the men skating in front of him?
""I used to have to get the husky pants when I was a kid,"" Boston Bruins defenseman Charlie McAvoy admits. ""Actually, once I became a Bruin, when I became a pro hockey player and had some walk-around money, then I discovered the jeans that were really soft, and they really fit to you. I got a couple pairs of those. But I just didn't wear jeans in college. I was a big sweatpants guy in college. Just Champion sweatpants. I roomed with Jordan Greenway -- he's a big boy -- and we would just wear sweatpants every day. We were the sweatpants and sweatshirts room.""
Once players start to have more disposable income, they find some brands that work. McDavid and Benn swear by Paige denim, which is known to use stretchier material, though an average pair retails for $199. McDavid also discovered an Ottawa-based brand, Heritage 34, this summer. Florida Panthers center Vincent Trocheck is a Diesel guy. Norwegian-born Blackhawks winger Andreas Martinsen found a Swedish brand he liked. So he bought pairs in black, and blue, and another shade of blue ....
But not everything has to be too pricey, as long as one is willing to experiment. Once Philadelphia Flyers captain Claude Giroux discovered the chain Zara, he found a sense of relief. ""I have smaller calves, too, for some reason,"" Giroux says. ""Zara, their suits fit me perfectly for some reason, so I'm there often. That's the one place I can shop.""
Those who aren't lucky enough to find a brand that works must resort to the more expensive option. ""Over the last three years, I realized I could get it custom,"" veteran Minnesota Wild center Eric Staal says. ""If you include the suits, I've spent a couple thousand, for sure."" Anaheim Ducks defenseman Josh Manson usually buys size 36 pants at the store, which is too big for his waist, but he gets everything else tailored.
""Every pair of pants I have is custom,"" Domi says. ""Whether it's jeans, joggers ... actually, I can get away with sweatpants, but that's it.""
A few smart businesses have cornered the niche market.
Leo Tropeano is a former soccer player who noticed that most jeans are built on the bell curve for the ""average guy."" He consulted with 2010 Hobey Baker winner Blake Geoffrion and realized hockey players were even more disproportionate. Two years ago, Tropeano launched the Chicago-based Mugsy Jeans. Although the ""custom denim that allows for flexibility"" isn't directly catered to hockey players, Tropeano has noticed that's who has latched on most. He says about five out of every 10 people who come into the Chicago storefront end up being ""hockey guys."" It's no coincidence that Mugsy advertises on the popular ""Spittin Chiclets"" podcast.
Catch more than 180 NHL games streaming live this season on ESPN+. Click here for the upcoming schedule and to learn how to subscribe.
The Canadian brand GongShow is even more overt. ""The hockey world is really small. Everyone knows everyone,"" says founder and CEO Ger McNamee, a former junior hockey player. ""Guys would come home in the summer, and if you noticed someone had a good-fitting pair of jeans, we'd all ask where they got it. If a guy found a pair, he'd order 10 to 12 pairs.""
GongShow was founded in 2002 and proudly boasts the world's first pair of ""hockey jeans."" The pants are a little looser in the thighs, have more area in the butt, and mix in a little spandex to be more forgiving. ""They're built for the hockey ass,"" McNamee says. The biggest pair of jeans GongShow offers is called the Quadrasaurus. The company has partnered with the CWHL, and in talking to women's players, it realized that finding properly fitting jeans isn't a gender-specific issue. The company launched a women's line last year.
Hockey players aren't alone. McNamee found that a slew of athletes from other sports -- downhill skiers, speed skaters and some weightlifters -- have the same problem finding pants.
Which brings us back to McDavid. As exceptional as he is at so many aspects of hockey -- on an unattainable level for most -- his struggle to find pants actually gives him comfort. It's one area where he's relatively normal.
""At least I know I'm not alone,"" he says.
"
25737710,"Richardson was injured in Arizona's 4-3 overtime victory over Vancouver on Thursday, and the Coyotes said he is week-to-week.
He joins goalie Antti Raanta, forwards Nick Schmaltz, Michael Grabner, Christian Fischer, and defenseman Jason Demers out with injuries.
Richardson, who was limited to 16 games in 2016-17 because of injuries, has 11 goals and five assists in 40 games this season.
Schmaltz, acquired from Chicago in a November trade, is out for the rest of the season with a lower-body injury, and Raanta might be, as well.
"
25715017,"Canadiens goaltender Carey Price, like Capitals captain Alex Ovechkin, will not be participating in the NHL's All Star game, opting to rest.
The Canadiens goalie is skipping the event to rest.
Vasilevskiy joins Tampa forwards Nikita Kucherov and Steven Stamkos on the Atlantic Division squad.
Vasilevskiy has a 16-4-2 record with a .920 save percentage and 2.60 goals-against average. He missed 14 games earlier in the season with a broken foot.
The Lightning have a league-best 66 points and are 8-1-1 in their past 10 games. Before losing to San Jose on Saturday, Vasilevskiy had won six straight.
"
25732242,"Chara, the NHL's tallest player ever at 6-foot-9, was flipped head over heels into the Capitals' bench on a shove from the 6-3 Ovechkin late in the first period.
The TD Garden crowd gasped, but play continued and there was no immediate on-ice retaliation. The Bruins captain tumbled back onto the ice quickly and rejoined the play.
The 41-year-old Chara has made a name for himself delivering bruising hits.
Ovechkin scored his NHL-leading 31st and 32nd goals, and Nicklas Backstrom got the winner in the third period to lift Washington over Boston 4-3.
"
25714873,"When the Coyotes put him on injured reserve on Jan. 4, the team said Schmaltz was considered week-to-week.
The 22-year-old has five goals and nine assists since being traded to Arizona by Chicago in late November for Dylan Strome and Brendan Perlini.
The Coyotes, who are seventh in the Pacific Division, are also missing starting goalie Antti Raanta. He went down in November with a lower-body injury and is done for the season. Forward Michael Grabner is out indefinitely with an eye injury suffered Dec. 1.
"
25713910,"Catch more than 180 NHL games streaming live this season on ESPN+. Click here for the upcoming schedule and to learn how to subscribe.
Gaudreau is on pace to shatter previous career highs with 119 points (his previous high was 84) and 48 goals (30), as he fires off more shots than ever, shoulders more attention from opposition, and emerges as a legitimate Art Ross Trophy threat and under-the-radar MVP candidate.
As if things couldn't get any better, the sports scheduling gods are smiling upon Gaudreau, too. The Flames' trip to Chicago coincided with Gaudreau's beloved Philadelphia Eagles facing the Chicago Bears in a playoff game at Soldier Field. Calgary had booked ice time Sunday but nixed practice. Instead Gaudreau, along with linemates Sean Monahan and Elias Lindholm as well as winger Matthew Tkachuk, scored tickets to the game.
""I had tried to buy a jersey when we were in Philly, but luckily Johnny bought us all Eagles toques,"" Lindholm says. After watching warm-ups at field level, the group settled in their seats where, according to Lindholm, they enjoyed anonymity. That is, until Chicago's double-doink field goal miss gave the Eagles an astounding victory.
""I don't think many people around me in the stadium were very happy with my celebration,"" Gaudreau admits, sheepishly.
""It was a little awkward,"" Lindholm says. ""But Johnny was loving it.""
And OK, not everything's coming up Gaudreau. Since the 25-year-old had to stay until the end of the game, leaving the stadium was logistically brutal, he says, as there was ""a lot of traffic"" heading back to the team hotel. If nothing else, it's a reminder: Despite his on-ice heroics, in a lot of ways, Gaudreau is an everyman.
Had Gaudreau been born four years later, he probably wouldn't have slipped to the fourth round of the draft; he was taken 104th overall in 2011. Gaudreau's superstar ascent rides parallel to the NHL's transformation into a faster, less brutish game as teams have accepted that small stature is not necessarily a hindrance. That wasn't the case when Gaudreau was coming of age as a prospect.
Football is king in the Cotton State, but from Huntsville to Birmingham and, yes, Tuscaloosa, there are many puckheads to be found.
Johnny Gaudreau, Amanda Kessel and Kaapo Kakko had big weeks, but the Blues goalie takes the prize.
Only two goalies have won the Hart Trophy as MVP this millennium. Here's why the Ducks goalie should be No. 3, plus updates on all the other award races.
For the 2011 draft midterm rankings from NHL Central Scouting, Gaudreau was slotted as the No. 209 non-goalie prospect in North America -- on a 210-man list. Then listed at 5-foot-6, 137 pounds, Gaudreau was deemed too small and too slight. In 2012, he was cut from Team USA's 2012 World Juniors Championship roster.
Gaudreau (now listed at 5-foot-9, 165 pounds) found a way to produce at every level. With 72 points in 60 games for the Dubuque Fighting Saints, the 17-year-old Gaudreau was not only the USHL Rookie of the Year in 2010-11, but an All-Star. At Boston College, he won the Hobey Baker Award as the top men's player in NCAA hockey. The legend of Johnny Hockey grew.
In the NHL, Gaudreau didn't record a point in his first six games -- then worked his way into the All-Star Game as a rookie in 2014-15. In a story that encapsulates hockey players' inherent modesty, Gaudreau trademarked the term ""Johnny Hockey"" in both Canada and the U.S in 2014. His agent told TSN at the time that they ""were concerned that people were going to abuse the Johnny Hockey name, coming out with Johnny Hockey shirts and stuff and we wanted to make sure that did not occur."" Four years later, Gaudreau has not leveraged the nickname into any significant mainstream endorsements.
Of course, Gaudreau is only one part of Calgary's renaissance season. The Flames -- off to their best start since 1988-89, when they last won the Stanley Cup -- boast four players who rank in the top 20 in league scoring (the most of any team) as Gaudreau's linemates Monahan and Lindholm have shined with 1.23 and 1.14 points per game, respectively. The trio even captivates while sitting on the bench, because of their obsession with purple Gatorade and superstitious insistence that Gaudreau must squirt the bottle into both of his teammates' mouths.
""I'm not even sure when that started,"" Lindholm says. ""It's funny that so many people caught on.""
Gaudreau's shot volume is up big-time this season; he's on pace for 269, about 70 above his career average. Last March, Gaudreau's father suffered a cardiac event and the team allowed Gaudreau to fly home to New Jersey for a few days to be with him. When Gaudreau returned, his father (a longtime high school coach) instructed his son to shoot more. While that might be at the back of his mind, Gaudreau attributes his increased volume to the team's offseason trade with the Carolina Hurricanes that brought him a new linemate in Lindholm.
""Last year I played with Michael Ferland, and he's a little bit more of a shooter,"" Gaudreau says. ""Lindholm obviously is a shooter as well, but he can see the ice really well and he can make some pretty high-end plays. So I've gotten more opportunity to shoot a little more with a player like that.""
Gaudreau's status as a shifty perimeter playmaker with smooth hands and sick stickhandling is well established. Coach Bill Peters says Gaudreau's biggest strides this season have come from his play away from the puck.
""I don't know if he shows it that much, but he's really competitive,"" Flames captain Mark Giordano says. ""He's really feisty out there sometimes. I think he's one of the best because he really wants to be the guy in those situations, a lot like Patrick Kane. They have the same vision, the same sort of skills, and those type of players want the puck in key situations.""
The Kane comparison came up a lot as the Flames visited Chicago this week. Peters likened the two players, and Gaudreau admitted he spent a lot of time admiring Kane before he got into the league. It's apt, really, as the Blackhawks are rebuilding, the Flames are surging, and the 30-year-old Kane makes way for the next generation of American stars, a group of which Gaudreau is certainly one of the headliners.
"
