26048494,"WEST PALM BEACH, Fla. -- When it comes to filling big shoes, Matt Adams has nothing on Babe Dahlgren and Ryan Minor.
Dahlgren is the man who replaced Lou Gehrig in the New York Yankees' lineup the day that the Iron Horse's consecutive-games streak ended. Nearly 60 years later, Minor is the one who stepped in for Cal Ripken Jr. Two decades after that, Adams is the answer to this trivia question: Who moved into Bryce Harper's locker?
Last year, Adams' first in Washington, his cubby was just around the corner from Harper's in the Nationals' oval-shaped spring training clubhouse. This year, when the veteran slugger reported to camp after signing a one-year free-agent deal to remain with the Nats, he found his jersey hanging in Harper's old spot. For what it's worth, he isn't losing any sleep over the relocation.
""I respect the guy and everything, but to me it's just a locker,"" Adams said. ""If I'm getting caught up in whose locker I'm in, then my mind's not in the right spot.""
With a stagnant market turning free agents into freeze agents, the lefty's six-year, $140 million pact with the Nats sticks out like a sore thumb.
Max Scherzer took a shot at MLB's free agency, saying teams getting on the win-loss cycle creates bandwagon fans and poisons the game.
Not only could Manny Machado's $300 million pact increase the price tag for Bryce Harper, it also could lead to even heftier free-agent hauls for Mookie Betts and Mike Trout in two years.
The same goes for Adam Eaton, who's expected to take over the full-time right-field gig that belonged to Harper for the better part of the past seven years. ""I played the position last year. I played it before he was born,"" joked Eaton, who's four years older than Harper but made his big league debut in 2012, the same year that Harper won the National League Rookie of the Year.
Of the 603 games that Eaton has played in his career, almost a third of them have come in right field. That includes 113 games with the White Sox in 2016, when Eaton saved more runs in right field (22) than anyone not named Mookie Betts. It also includes 65 contests last season, when Harper was busy moonlighting in center field. As you might expect, Eaton isn't the least bit concerned with following in the former MVP's footsteps.
""The media puts a lot of emphasis on it, but we're professionals,"" Eaton said. ""We've just got to go out there and play. If George Herman Ruth was here and he left, we'd be like, 'That's cool. He was here, now he's gone.' Everyone's on the same page.""
Of course, it doesn't hurt that everyone has seemingly been talking about Harper's potential exodus from Washington since ... well, since Washington himself was in the White House. In other words, the Nationals have had more than enough time to prepare themselves for the possibility of Harper taking free-agent flight. And it shows.
""Knew it was a possibility. We knew that last year,"" said ace Max Scherzer, who knows a thing or two about high-profile free agents switching teams. In 2015, Scherzer came to Washington on a seven-year, $210 million deal, after having spent the previous five seasons in Detroit. Four years later, he's completely matter-of-fact about the prospect of life after Harper. ""Look, teams change. It's part of the thing.""
The thing that Scherzer refers to is the business of sports. And like any business -- whether it's banking, building or baseball -- the bottom line is the loudest line. That's why, when the Nationals signed hurler Patrick Corbin to a splashy six-year, $140 million contract in December, the writing was on the wall. And what the wall said was this: The odds of the Nationals -- who were above the luxury tax last season and still have to think long and hard about shelling out serious cash to give third baseman Anthony Rendon a contract extension sometime in the very near future -- retaining Bryce Harper just shrunk faster than a slice of bacon sizzling on a hot skillet.
Does that mean the Nationals won't re-sign Harper? Not necessarily. Now that Manny Machado is finally off the board and $300 million richer, is there any chance that his free-agent foil doesn't end up in a Phillies (or some other) uniform, owner of a contract that's decidedly larger than the $300 million one that Washington supposedly offered Harper at the end of last season? Sure, there's a chance. But for now, Everyone -- with a capital E -- in the Nats organization seems more than prepared to move ahead without him. More than prepared to get on with the business of baseball.
""Would I love for him to be here? Of course,"" said first baseman Ryan Zimmerman, who's spent his entire 14-year career in Washington and played alongside Harper longer than any other current member of the Nationals, and whose spring training locker is right next to Adams' cubby. ""But we all understand the business and the economics. That's just how it works. You get so used to the shuffling in and out of players. You get used to learning how to deal with it.""
Rookie of the Year hopeful Victor Robles celebrates ""scoring"" during a running drill here at #Nationals camp. #SpringTraining pic.twitter.com/YpiI6WHX5c
But what if Harper winds up with a division rival like Philly? What if, over the course of the next 10 years, the Nationals have to face their former franchise face 180 times during the regular season?
""It doesn't bother me wherever he goes,"" Zimmerman said. ""He's earned the right to do that. Will it be weird playing against him? Of course. But we've all played against people that we've been teammates with. I just hope he gets what he deserves. He's done some pretty special stuff at a young age. He should get rewarded for it.""
That last part, the part about getting rewarded and getting what he deserves, is a common theme. To a man, pretty much every single player inside the Nationals clubhouse seems to genuinely want Harper to get what's his. Because they know that if and when the time comes for them to hit free agency, they'll do everything in their power to get what's theirs. They're all together on this. After all, the players' union isn't called a union for nothing. As a result, everyone seems to be pulling for Harper to cash in, regardless of which front office is handing out that cash.
How do the best at each position rank and what tier of production do they fit in?
Positions: First basemen | Third basemen | Outfielders | Starting pitchers
That even goes for Nationals pitcher Erick Fedde, who grew up with Harper in Las Vegas and has known him since T-ball: ""It's a presence you'll miss in the clubhouse, but baseball's taught you to accept that sometimes you're going to lose friends."" Fedde admits that ever since the end of last season, anyone and everyone has been asking him where Harper is going to sign. His answer? ""I don't know. But I hope it's whatever's best for him.""
What's best for the Nationals right now -- and they're more than happy to tell you this -- is worrying about the guys who are in West Palm Beach instead of The Guy who isn't.
""We're going to talk about the players that we have here on the team,"" said GM Mike Rizzo, when asked about Harper a few days into spring training. ""We're not going to talk about the players that we don't have on the team. We've got a roster that we like, and we're poised to start the season as is because we really like the team that we have.""
Added manager Davey Martinez: ""I can't really think about the free agents. I've got 58 guys in camp. ... We're going to focus on the guys we have today and get them ready to play.""
In the meantime, it's worth noting that not all uniform numbers have been treated equally within the Nationals clubhouse. While the numbers of several prominent but now departed members of last year's team have been redistributed -- reliever Kyle Barraclough is wearing Daniel Murphy's old No. 20, and Gio Gonzalez's 47 now belongs to Howie Kendrick -- the No. 34 is currently not in circulation. Maybe that's just a coincidence. Then again, maybe it's not.
Maybe the Nationals are intentionally ""resting"" Harper's digits, the same way they rested Jayson Werth's No. 28 for a year before handing it out this season.
You know, just in case he comes back.
"
26235002,"Los Angeles announced agreements Monday with 22 players not yet eligible for arbitration. Ohtani has a split contract with a salary of $272,500 while in the minor leagues.
The 24-year-old two-way star went 4-2 with a 3.31 ERA in 10 starts as a pitcher and played 104 games overall as a rookie, hitting .285 with 22 homers and 61 RBIs. He had surgery Oct. 1 to repair a torn ulnar collateral ligament, and the Angels think the earliest he could be ready to hit in games is in May. He isn't expected to pitch this year.
Ohtani left the Nippon Ham Fighters of Japan's Central League after the 2017 season and signed with the Angels for a bonus of $2,315,000. He will not be eligible for salary arbitration until after the 2020 season.
He will earn considerably more than Tampa Bay pitcher Blake Snell, last year's AL Cy Young Award winner. The Rays renewed his contract Sunday for a salary while in the majors of $573,700, a raise of $15,500 and a figure $18,700 above the major league minimum, which rose to $555,000.
"
26254679,"Get everything you need to prepare for your fantasy baseball drafts here, including rankings and analysis from ESPN's team of experts.
A major shake-up brings a new crew of All-Stars to the forefront, with some of the game's biggest names on the outside looking in.
""We're not going to take a chance,"" manager Alex Cora said. ""He wasn't going to play tomorrow anyway, so he'll come here, get treatment and see how he feels.""
Cora said Martinez will not travel with the team to Tampa, Florida, on Friday to play the New York Yankees.
""If he's OK to play, probably get at-bats on the minor league side,"" Cora said. ""There's no need to rush him.""
Martinez, who had been injury-prone earlier in his career, was an iron man for the Red Sox last season, appearing in 150 games, with a .330 average, 43 home runs and 130 RBIs.
"
26056978,"Judge Regina Cahan ruled Friday that Martin had signed a contract with the team that called for any contract dispute to be resolved via arbitration, and that the contract was signed prior to a new state law that calls for cases of discrimination to be heard in open court.
Martin's lawyer had argued that the Mariners wanted arbitration as a way to keep the case out of the public spotlight, The Seattle Times reported. But Cahan said the new law, which went into effect last June, did not pre-empt the clauses in Martin's contract calling for arbitration.
From Paul Goldschmidt in St. Louis to Josh Donaldson in Atlanta, we tell you what to expect from some familiar faces in new places.
Martin was fired as the Mariners' high-performance director last fall after one season on the job. She has claimed she was discriminated against by members of the organization and claimed that general manager Jerry Dipoto, director of player development Andy McKay and manager Scott Servais made disparaging comments against Latino players.
The Mariners have denied Martin's claims. An independent investigation by Major League Baseball found no credible evidence to support Martin's claims of disparaging comments and discriminatory treatment by members of the Mariners front office.
Martin had signed a three-year contract with the team after being hired away from the Los Angeles Lakers in the fall of 2017.
"
26230045,"One hurdle to their employment that has perhaps been under-reported is that both players turned down a $17.9 million qualifying offer from their previous team. That means the signing team must pay a draft-pick penalty, which varies depending on that team's financial status. It's worth noting that all first-round picks are now protected unless a team has multiple first-round picks. In that case, the team loses its later pick. This is an obstacle and part of the reason Kimbrel and Keuchel remain unsigned, but it isn't an insurmountable one.
In his first exclusive interview since joining the Phillies, Bryce Harper goes deep on rejecting $300 million, recruiting Mike Trout and playing in Philly for life. Tim Keown
(As an aside: If there's one thing the MLBPA needs to fight for in the next collective bargaining agreement, it's getting rid of all free-agent compensation and draft penalties. Once you reach free agency, you should be a free agent. You've earned the right to not have any restrictions placed on your services.)
Anyway, it's possible that Kimbrel in particular could wait until after the draft in June to sign. At that point, his free-agent status would no longer be tied to any draft penalties. Since teams are likely interested in him on a shorter-term deal to begin with -- even potential Hall of Fame closers are still closers, with all their inherent risks -- he could sign a one-year, prorated deal and then head back into free agency. As a second-time free agent, he would no longer be tied to the draft-pick penalties. If he waits, there's also the chance that some contending team's closer gets injured or somebody's bullpen falters, and suddenly interest increases.
I don't think that will happen. I still believe he and Keuchel will sign soon. Here's a look at some of the likely landing spots for each player:
CRAIG KIMBREL
Washington Nationals
Current closer/top setup guys: Sean Doolittle / Trevor Rosenthal, Kyle Barraclough
Bullpen rank (via FanGraphs projections): 12th
The Nationals are currently about $4.5 million below the luxury-tax threshold, and going over for a third straight season would mean paying a 50 percent tax on every dollar above the threshold. Still, there is an obvious need for bullpen depth here behind Doolittle, as the team is counting on Rosenthal coming back after missing all of 2018 and Barraclough, who has averaged 5.5 walks per nine innings in his career, to throw enough strikes to avoid his declining trends the past three years with the Marlins.
Los Angeles Dodgers
Current closer/top setup guys: Kenley Jansen / Joe Kelly, Pedro Baez
Bullpen rank: Eighth
Jansen was one of the best closers in the game until last season, when he served up 13 home runs in 71⅔ innings, though he blew just four save chances. He has struggled in the past two World Series, with three blown saves, a loss and four home runs in nine appearances. Of course, Kimbrel also was shaky last October through the postseason, though he managed to avoid any blown saves. The Dodgers have more depth than the Nationals, with the likes of Caleb Ferguson, Dylan Floro and Scott Alexander, and signing Kimbrel would create a closer controversy that might be a big headache for Dave Roberts.
Atlanta Braves
Current closer/top setup guys: Arodys Vizcaino / A.J. Minter, Dan Winkler
Bullpen rank: 16th
The Braves ranked 17th in the majors in bullpen ERA in 2018, and FanGraphs projects only a small improvement (3.85 ERA), which would again leave them in the middle of the pack. Kimbrel and his family were recently spotted having dinner in Celebration, Florida, near where the Braves hold spring training, but maybe he just took the family to Disney World. The Braves have made just one significant move this offseason -- signing Josh Donaldson -- and adding Kimbrel would bring him back to where he started his career.
Philadelphia Phillies
Current closer/top setup guys: David Robertson / Seranthony Dominguez, Pat Neshek
Bullpen rank: Fifth
Gabe Kapler ran a hyperactive bullpen last year -- only the Angels and Cubs had more relief appearances -- and they've added Robertson, Juan Nicasio and James Pazos to a group that ranked 18th in the majors with a 4.19 ERA. With Robertson and Dominguez, I don't think there's an urgent need for late-game relief here, but adding Kimbrel would allow Kapler to push Robertson and Dominguez back into the seventh and eighth innings and shorten games for a rotation that has some questions behind Aaron Nola.

The MLB season will be here before you know it. That means it's time to draft your fantasy baseball team.
Create or join a league today.
Get rankings and more for your draft.
Minnesota Twins
Current closer/top setup guys: Trevor May / Taylor Rogers, Addison Reed
Bullpen rank: 13th
The Twins haven't been linked to Kimbrel the way the first four teams listed here have, but they might be the team that would benefit the most from signing him, especially since they have a chance to chase down the Indians in the AL Central if things break right. Fernando Rodney was the closer last year until he was traded, so May will have to win the job in spring training, but he's the favorite after a strong showing down the stretch last year. Reed and Trevor Hildenberger had long ball issues last year, as did free-agent signing Blake Parker while with the Angels. This group could be good or bad. Signing Kimbrel would add a little more certainty.
Los Angeles Angels
Current closer/top setup guys: Cody Allen / Justin Anderson, Cam Bedrosian
Bullpen rank: 24th
The Angels signed Cody Allen, coming off a rough season in Cleveland, and are counting on the hard-throwing Anderson and rookie Ty Buttrey, but they clearly lack a settled late-game group. Signing Kimbrel would help, but the Astros are such heavy favorites in the division that L.A.'s best bet for a postseason slot remains the wild card. Apparently that hasn't been enough to entice the Angels to spend big this winter.
Boston Red Sox
Current closer/top setup guys: Matt Barnes / Ryan Brasier, Tyler Thornburg
Bullpen rank: 22nd
Oh, yes ... the Red Sox. Dave Dombrowski and ownership have been consistent all spring, saying that there is basically no chance Kimbrel returns to the Red Sox. The team's bullpen depth has been hurt in recent days, however, as Steven Wright was suspended 80 games for a PED violation. Brasier has been slowed by an infection in his toe, and Thornburg has struggled early in spring training, allowing 10 hits, seven runs and two home runs in four innings. The Red Sox might be a little more desperate for relief help than they were at the start of camp. Can they win the division without Kimbrel? Sure. Can they lose the division with Kimbrel? Sure. But bringing him back makes them better.
DALLAS KEUCHEL
Philadelphia Phillies
Current rotation: Aaron Nola, Jake Arrieta, Nick Pivetta, Zach Eflin, Vince Velasquez
Rotation rank: 13th
This is still the team most often linked to Keuchel -- even after all its offseason maneuvering. It's easy to see why Keuchel makes sense: Pivetta, Eflin and Velasquez combined to go 27-34 with a 4.68 ERA. They also fanned 478 in 438⅔ innings, so the Phillies can envision better results from them. I do like Pivetta in particular as a breakout candidate, but Keuchel would be the No. 2 guy in this rotation and would allow Philly to bump Velasquez into a swingman/long relief role.
San Diego Padres
Current rotation: Joey Lucchesi, Eric Lauer, Robbie Erlin, Matt Strahm, somebody else
Rotation rank: 17th
Lucchesi and Lauer were rookies in 2018, Erlin started a career-high 12 games, and Strahm has eight career starts. In other words, this is a very inexperienced rotation. Chris Paddack, who hasn't pitched above Double-A, has looked so good that he's reportedly part of the battle for the Opening Day assignment (but most likely, he starts the year in the minors). Those four are all lefties, so bringing in Keuchel as a veteran mentor makes some sense, but after spending big on Manny Machado, Keuchel is probably an unlikely fit.
Atlanta Braves
Current rotation: Mike Foltynewicz, Sean Newcomb, Kevin Gausman, Julio Teheran, Touki Toussaint
Rotation rank: 18th
Atlanta mainstay Julio Teheran hasn't answered the questions he faces following a shaky season in 2018.
Major League Baseball's new partner is breaking out some drastic rule changes. Here's what the Atlantic League innovations mean and how likely they are to hit the majors.
As we prepare to unveil our top 100, we consider who was better (or worse) than last year's ranking and predict what we'll see in this year's voting.
Foltynewicz, coming off a season with a 2.85 ERA and 202 strikeouts in 183 innings, was to be the team's Opening Day starter, but the Braves announced Monday that he'll miss that assignment due to the sore elbow that has kept him off a mound since Feb. 24. Remember, the Braves are already down Anibal Sanchez, who signed with the Nationals after posting a 2.83 ERA in 24 starts. Yes, they have plenty of young arms waiting in the wings, including Kyle Wright, Max Fried and Mike Soroka, but Keuchel gives them certainty if they have to hedge against Foltynewicz's health.
Minnesota Twins
Current rotation: Jose Berrios, Kyle Gibson, Jake Odorizzi, Michael Pineda, Martin Perez
Rotation rank: 15th
The comment here is similar to the Kimbrel one for Minnesota: The Twins might have the most to gain, considering the gap between their fifth starter and Keuchel and the improved odds of making the playoffs that Keuchel would bring. That rotation ranking feels pretty generous, as there is obvious volatility in what to expect from Pineda (coming off Tommy John surgery) and Perez -- and even Gibson and Odorizzi (his ERA has risen three seasons in a row). They do have youngsters Fernando Romero and Stephen Gonsalves, but Romero might end up in the bullpen, and Gonsalves is more of a 4-A arm unless he learns to throw more strikes.
New York Mets
Current rotation: Jacob deGrom, Noah Syndergaard, Zack Wheeler, Steven Matz, Jason Vargas
Rotation rank: Sixth
Vargas was terrible in 2018, and the others have had various issues with staying healthy. There is basically no depth behind those five. The Mets are well under the luxury tax, and their long-term commitments beyond Robinson Cano are minimal. Just because they're paying Vargas $8 million this year (plus a $2 million buyout) is no reason not to sign Keuchel.
Texas Rangers
Current rotation: Mike Minor, Lance Lynn, Drew Smyly, Shelby Miller, Edinson Volquez
Rotation rank: 26th
This is an all-reclamation rotation, as the Rangers hope to get something out of Smyly, Miller and Volquez. Good luck. The Rangers aren't going to contend for the playoffs this season, but they move into a new park for 2020 and presumably will be looking to be more competitive then. They have money to spend, and it's not like this is an organization that has been churning out starting pitchers the past several years.
Seattle Mariners
Current rotation: Marco Gonzales, Yusei Kikuchi, Mike Leake, Wade LeBlanc, Felix Hernandez
Rotation rank: 20th
The Mariners aren't billing themselves as contenders, but neither are they in a complete rebuild. They have Justus Sheffield waiting to take over a slot and Justin Dunn after him, but King Felix has looked horrible in spring training, and LeBlanc will likely regress from his 3.72 ERA/4.28 FIP from a season ago. Keuchel would project as the team's best starter, and Hernandez's big salary comes off the books after this season.
New York Yankees
Current rotation: Masahiro Tanaka, Luis Severino, James Paxton, J.A. Happ, CC Sabathia
Rotation rank: Second
The Yankees keep insisting that they're simply being cautious with Severino's shoulder, so at this point it doesn't appear to be a long-term concern. Even if Severino misses a couple of starts, there is capable back-of-the-rotation depth with the likes of Luis Cessa (who has looked good so far in camp), Domingo German and Jonathan Loaisiga. You also wonder if the Yankees have their sights set on a bigger Astros free-agent pitcher next offseason: Gerrit Cole or Justin Verlander.
"
26230199,"Moustakas, who re-signed with the Brewers on a one-year, $10 million deal last month, has never played a game at second base in the majors or minors.
He has been playing the position in spring training, however.
""I'm really enjoying it at second. It's fun; it's new. And I feel comfortable, which is the most important thing. I'm getting a lot of work over there,"" Moustakas told reporters, according to the Journal Sentinel.
Counsell admitted that Moustakas won't have ""high-end range"" but said he is ""very instinctual as a player.""
Moustakas, 30, has primarily been a third baseman in the majors, but Travis Shaw is starting at third for the Brewers.
Moustakas hit .256 with eight home runs and 33 RBIs in 54 games with Milwaukee last season after the Brewers acquired him July 27 in a trade with the Kansas City Royals.
"
