26156306,"Dodgers manager Dave Roberts said Wednesday that, for now at least, Kershaw remains scheduled to start March 28 for the two-time defending NL champions even though it seems unlikely based on the progress the three-time Cy Young Award winner would need to make in the next few weeks.
""I don't think we've made that decision yet, and I know that Honey [pitching coach Rick Honeycutt] has mapped out where we need to be, so right now, we're not ready to make that decision,"" Roberts said. ""We're just right now in a day-to-day with Clayton and trying to keep him in a positive state of mind.""
Kershaw played catch with teammate Rich Hill on Tuesday's off day and lined up down the right-field line with fellow pitchers Wednesday as several played catch. Kershaw's partner was bullpen catcher Steve Cilladi.
Although Cilladi did not crouch, Kershaw went into his unique windup before several throws, raising his hands over his head and pausing his leg in midmotion. Kershaw repeatedly backed up, eventually throwing from more than 75 feet, before moving closer to Cilladi and increasing the velocity on his throws.
Afterward, he flashed a thumbs-up to an observer and gave Cilladi a fist bump.
Prior to the afternoon throwing session, Roberts said: ""The distance is increasing a little bit, and most importantly, the intensity. So, for him to ramp up that intensity and recover the next day and still feel good, that's a good thing for us.""
As for when Kershaw will throw off a mound, Roberts said: ""We'll know more each day. We don't have a day right now.""
CATCHING ON
After several days of practice and Cactus League inactivity because of a sore lower back, veteran catcher Russell Martin started hitting and caught Walker Buehler's bullpen.
""Today is the first day I took some swings and I just got done, so it felt pretty good,"" Martin said. ""Obviously, it wasn't max effort, but it was definitely positive.""
Martin progressed from dry swings to hitting off a tee to soft toss.
""So far, so good,"" he said. ""We are taking it slow and trying to be smart about it.""
Martin's training room treatment has consisted of stretching, strengthening and ""getting some range of motion and strength in that newfound range of motion, and hopefully, that will keep me on the field,"" he said.
Roberts said: ""It is kind of a day-to-day thing -- depending on how Russell feels and the training staff -- whether we get him some at-bats on the other side [in minor league games] or just jump him right in and DH or just kind of throw him in the fire. Russell, as a veteran player, knows exactly what he needs to do to get ready, so even a week down, I don't think it will impact him too much.""
NOTES
Buehler has not appeared in a Cactus League game. Roberts said the right-hander is likely to throw live to hitters on Saturday or Sunday.
SS Corey Seager, completing his recovery from Tommy John surgery on May 4 and arthroscopic hip surgery on Aug. 7, was not in camp because of ""a little kind of a sickness, a little bug,"" according to Roberts. Because of that, Seager's planned appearance in a minor league game Thursday is doubtful.
Roberts and his staff will start to make cuts in the coming days, sending players to the minor league side. Position players will start to play in back-to-back Cactus League games, and starting pitchers will begin to throw increased innings in those games.
The Dodgers optioned LHP Adam McCreery and reassigned LHP Josh Smoker and RHPs Joe Broussard, Daniel Corcino and Jesen Therrien to minor league camp.
"
26150357,"""My strength is the same,"" said Severino, who suffered a shoulder injury minutes before a scheduled start against the Atlanta Braves on Tuesday. ""I feel like something pulled.""
An MRI late Tuesday afternoon revealed that Severino had right shoulder inflammation. It apparently set in after Severino threw a slider while throwing warm-up pitches at George M. Steinbrenner Field.
In the wake of Luis Severino's shoulder injury, we weigh in on who is most likely to get the nod March 28 in the Bronx.
For a pitcher as accomplished as Keuchel, there will always be interest. But time -- and his lack of velocity -- isn't on his side.
""His competition, for me, is in the monuments,"" Yankees legend Reggie Jackson said.
Severino said he didn't throw another pitch after he felt the twinge.
This was the first time Severino has experienced pain after throwing a slider. He went through a simulation game on a back field last Thursday and made it through with no issues, he said.
Because of the injury, manager Aaron Boone said Severino would be shut down for the next two weeks. Severino will take a cycle of anti-inflammatory medication as he rests his shoulder.
""Hopefully it's as short as necessary, but we need to make sure we give it the time also that's necessary,"" general manager Brian Cashman said Wednesday. ""He's an important piece and we're not going to have him for a period of time.
""We'll adjust. That's what everybody has to do. But it's obviously a very concerning situation until he's on the mound for a consistent amount of time to the point that you forget it ever happened.""
Cashman said Severino was due to receive a cortisone shot at some point Wednesday.
The Yankees hope Severino will be able to resume a throwing program after his two-week break. Boone said it was ""highly unlikely"" that Severino would start Opening Day as had been planned.
""It's frustrating, because the bad thing about baseball is you don't [always] get to play baseball,"" Severino said. ""This is the game that I love, and I want to be there for the team. It's going to be tough for a little bit, but after that, like I said, it's better it happened now than in midseason or at the end of the season.
""God has a plan for everybody, so it's better now than later.""
Until Severino returns, the Yankees plan to keep using the pitchers they currently have. Young pitchers Domingo German, Jonathan Loaisiga and Luis Cessa would contribute to that depth in the interim.
Although free-agent left-handed starter Dallas Keuchel remains unsigned, Cashman gave little indication that he would go after him or any other pitchers from outside the organization. He isn't completely ruling it out, but he seems lukewarm to the idea at the moment.
""What I've got is what I've got,"" Cashman said, ""and we're comfortable with that. Can't rule anything out, but I'd say the main focus is what we have.""
Cashman also said outfielder Jacoby Ellsbury, who has spent the start of spring training rehabbing at home in Arizona from a plantar fascia issue, is expected to rejoin the team in approximately 10 days.
"
26259301,"A single trade deadline, an All-Star Game election day and a million-dollar bonus for the Home Run Derby winner will be implemented in 2019 -- and a three-batter minimum for pitchers and roster expansion will happen in 2020 -- as part of a deal between Major League Baseball and the MLB Players Association.
Spurred by labor relations discord amid a second consecutive free-agent market that has left players disappointed, the mid-collective-bargaining-agreement negotiations represent a step forward between two sides that had squabbled privately and publicly.
Perhaps the most important part of the deal isn't the elimination of August trades, the tweaking of All-Star Game starter selections, the incentives for stars to participate in the derby, the elimination of one-out relievers or the addition of a 26th player next year. It's the provision that the sides will begin discussing labor issues imminently, far earlier than they typically would with a CBA that doesn't expire until December 2021.
Those discussions, sources told ESPN, will center on the game's most fundamental economic tenets -- not only free agency but other macro issues with deep consequences. The bargaining over distribution of revenue could be the most difficult gap to bridge, with teams clearly paring back spending on aging players while players chafe at the notion that those 30 and older are no longer worthy of the deals they received in the past. While a compromise could be reached in distributing more money to the younger players whom the current system underpays, the complications of doing so warrant a long runway for discussions.
A major shake-up brings a new crew of All-Stars to the forefront, with some of the game's biggest names on the outside looking in.
Leading off our countdown of the game's best, youngsters duel with historic greats. Which players landed on the back half of our list?
You picked who? Where? We break down some of the questions to come out of the rankings -- and ask you to weigh in as well.
Other subjects to be broached include the manipulation of service time that keeps the best prospects in the minor leagues to begin a season, the luxury-tax threshold that some believe discourages spending, and the gathering of biometric data that has become commonplace among major league teams.
While the incentive is strong to repair fissures in the relationship -- and perhaps even extend the current CBA, which guaranteed more than a quarter-century of labor peace amid $10 billion-plus a year in industry revenues -- doing so will require significant compromise from both sides. The prospect of division internally in either party is palpable as well, whether it's players young and old or owners in large markets and small.
There is nevertheless optimism from commissioner Rob Manfred and union executive director Tony Clark after the most recent bargaining ended with a deal. Although the union did not formally accede to the three-batter minimum per pitcher that MLB sought, it agreed not to challenge the league's plans to implement it in 2020. MLB had the same ability to put a pitch clock in place this season but tabled it as part of the deal, with the hope that fewer pitching changes -- and shorter inning breaks, which are now down to two minutes for local and national games, per the deal -- will speed up games.
What will be in place this summer are a single July 31 trade deadline, an All-Star election day and a Home Run Derby with the game's biggest stars (both sides hope) vying for a $1 million bonus. Deals after the non-waiver deadline made August a hotbed for incremental upgrades by teams, and the union's hope is that getting rid of them will cause teams to be more aggressive in the offseason knowing that the fallback for August deals no longer is an option.
Though the consequences of the single trade deadline are unknown, the impact of an election day is clear: MLB gives itself a much-needed opportunity to market its players. Fans will vote online for All-Star starters, and the top three vote-getters will take part in a one-day election, which could lead to a bevy of clever electioneering, social media engagement and displays of personality players rarely show.
It will culminate in an All-Star week that includes a Home Run Derby with $2.5 million in prize money, including $1 million for the winner.
The 2020 provisions are likely to have a far greater impact on the field. In addition to the three-batter minimum, regular-season rosters will expand from 25 to 26 players while September rosters will contract to a maximum of 28 from the current 40. A committee between the sides that will study the game is expected to make recommendations on the maximum number of pitchers allowed on the rosters. In negotiations, the league proposed 13 during the first five months of the season and 14 in September.
The number of position players pitching could see a significant decrease as well. Under the agreement, players will be designated as position players or pitchers -- with the exception of those who throw 20-plus innings and start 20 games in the field or at DH, who will be two-way players. Position players will be allowed to pitch only in extra innings or when their team is ahead or behind by more than seven runs.
"
26228513,"Estevan Florial, long considered among the top talents in the Yankees' farm system, had fallen in the eyes of national prognosticators. Rated by some to be a top-50 prospect in 2018, Florial found himself below that entering 2019.
ESPN's Keith Law, troubled only in part by the more than two-month injury from a broken hamate bone Florial endured last year, again had him just outside of his top 100.
""His competition, for me, is in the monuments,"" Yankees legend Reggie Jackson said.
After a season-ending concussion, the Yankees outfielder just wanted peace and quiet. But his doctor had a very different idea: Turn it up to 11.
As the slugger who took the Bronx by storm last season battles Greg Bird for a spot on Opening Day, he's focused on turning his biggest weakness into a strength.
All of which raises the questions: Is the 21-year-old center fielder still a rising star? Has the flame around the Bombers' former No. 1 prospect burned out?
The Yankees, for their part, say Florial is shining brighter than ever.
""He's got as high a ceiling as just about anyone in that clubhouse,"" manager Aaron Boone said earlier this spring. ""Nothing's changed there.""
Added veteran outfielder Brett Gardner: ""As talented as he is, it's not going to be long before we see him put it all together.
""He's got a bright career ahead of him for sure.""
The proof of that, the Yankees believe, rests with how Florial has performed both this spring and last.
A year ago, the outfielder showcased his best asset -- his speed -- by racing around the bases to the tune of three triples in 21 spring training games. His range in the field caught attention, as did the work he put in behind the scenes.
Fast-forward to this spring, and the Yankees say they believe there's even more reason for optimism.
Entering play this week, Florial had a .333 batting average with a .926 OPS, a home run, four RBIs and four stolen bases through only 10 spring training games. Although he still had seven strikeouts and only two walks, his pitch recognition -- one area where he has struggled in the past -- has generally improved.
""[I'm] trying to get more control of the strike zone,"" Florial said at the start of the spring.
A prime example of that came on one swing Florial had last Thursday in a game against the Phillies in nearby Clearwater. With two on in the top of the sixth, he made a midswing adjustment to a pitch riding middle-in, and stroked a hard liner over the wall in left-center.
Baseball season is almost here! Check out updates from all 30 teams in Florida and Arizona. Complete coverage »
The three-run, opposite-field shot had the visitors dugout buzzing about the lefty's sweet swing.
""I mean, wow. There is a short list of people who can hit a ball hard like that,"" Boone said to reporters after that game. ""I told that to Reggie Jackson on the bench.""
Jackson, according to Boone, turned to the manager and said he knew that list was short -- because the Hall of Famer was on the list.
Another Yankees legend, former infielder Willie Randolph, has been similarly moved by what he has seen from Florial this spring. Randolph went so far as to describe Florial as a ""young Bernie Williams"" to the New York Post last week. Considering Williams had his No. 51 jersey retired four years ago, that's not a bad comparison for the youngster to draw.
""The way he goes about his business, his work ethic, just his desire and his willingness to listen and to learn and get better, I don't see many 20-, 21-year-old kids come through here that are that mature,"" Gardner said.
That maturity manifests itself in the patience Florial exhibits. Days after the Yankees re-signed center fielder Aaron Hicks to a seven-year, $70 million extension, Florial was asked if he was nervous he might be considered a trade chip now. After all, the long-term investment in Hicks had to mean the Yankees saw little future for Florial, right?
""We love Hicks here. Who wouldn't like to have Hicks on their ballclub?"" Florial said. ""For me, I'm blessed to have him next to me, so I can learn from him.""
A lower back injury has kept Hicks out much of the past two weeks, giving Florial more chances.

The MLB season will be here before you know it. That means it's time to draft your fantasy baseball team.
Create or join a league today.
Get rankings and more for your draft.
General manager Brian Cashman has been pondering whether Florial's year should begin at Single-A Tampa (where he hit .255 with three homers, three triples, 27 RBIs and was 11-for-21 in stolen bases in an injury-shortened 75 games last year) or Double-A Trenton. If he begins at Double-A, it would be the highest level Florial has played in the Yankees' organization.
Signed out of the Dominican Republic in 2015, Florial has spent the past two springs as a non-roster invitee. In addition to showing off his power in this one, Florial has been let loose on the basepaths.
In a game last week against Atlanta, Florial led off the bottom of the seventh inning by beating out an infield single. Two batters and two outs later, the wheels came out again.
After stealing second base, the speedster advanced to third on a passed ball. Then he scored on a wild pitch. Florial had manufactured a run in a way the powerful Yankees (who set a single-season home run record last season with 267) don't often do.
These anecdotes -- the three-run home run and the blistering baserunning speed leading to a score -- are prime examples of why the Yankees remain high on Florial, even if others are lukewarm.
""He doesn't recognize pitches well enough to get to his tools. Florial has bat speed, power, running speed, athleticism, quick twitch and all the tools that glitter, but his ability to pick up pitch types is not good enough to put him into the top 100,"" Law wrote in January. Meanwhile, MLB.com's prospect rankings saw Florial fall a dozen spots this year, from No. 45 to No. 57, and, after being ranked No. 38 last year by Baseball America, he slipped off their top 100 entirely.
Still, Boone likes what he sees: ""His ceiling, it's why he's probably always considered the [Yankees'] No. 1 prospect. It's [a] good reason. I remember first seeing him last year and one of the things that grabs you is just how physical he is. He's good to look at. He looks the part. He's tall, he's built. Still obviously a very young man.
""I don't know if it's necessarily changed in my eyes, because I remember being really impressed with the way he looks on a baseball field.""
"
26273910,"""I think he's going to miss a significant amount of time,"" manager Dave Martinez said Friday.
Taylor favored his left leg as he limped through the clubhouse earlier in the day before heading to undergo an MRI.
""He's a big part of our ballclub,"" Martinez said after getting test results. ""So I just hope that he recovers quickly, and we can get him back out there as soon as possible.""
The Rookie of the Year runner-up put up historic numbers as a teenager. Now 20, he's the new heart of the Nats' lineup -- and drawing comparisons not just to his former teammate but also to Mike Trout.
Taylor had been set to enter the season as one of Washington's top four outfielders; it appeared he was going to be the first one off the bench, behind starters Adam Eaton in right, Juan Soto in left and rookie Victor Robles in center.
Robles and Taylor are the only true center fielders available to Martinez, who acknowledged Friday, ""You're correct: There's no outfield depth,"" after a reporter brought up the issue.
Bryce Harper, of course, has departed for the Philadelphia Phillies, a year after another starter, Jayson Werth, left the Nationals. The club traded two backups last season, and while Eaton is a veteran starter, Soto was an unexpected revelation at 19 last season, and Robles appears ready to make an impact at 21, Taylor was the only other sure thing in the outfield.
Taylor said his knee and hip stiffened shortly after he made a diving catch in center during the second inning of Washington's 10-4 victory over Minnesota on Thursday.
""I went to slide, and the outfield was a little soft, and my knee stuck in the ground,"" Taylor said.
In the moment, Martinez said, ""It was kind of scary. I ran out of the dugout right away, because it didn't look too good.""
Now Andrew Stevenson will see time in center field, and the team could look for other options.
""When you start a season with just four outfielders, you want a guy who can play center field,"" Martinez said. ""So we're going to have to really look for that guy.""
Matt Adams, a backup first baseman, started Washington's 11-3 win against the New York Mets on Friday. Of the more than 470 starts Adams has made in his major league career, only 30 came in left.
Martinez said that Wilmer Difo, a backup infielder, also will see time in the outfield in the coming days.
Another utility player who can play in the outfield, Howie Kendrick, is working his way back after straining his left hamstring in a game March 5. Martinez said Kendrick is not yet running at full speed.
Game notes
Newly signed LHP Tony Sipp said he's been throwing two bullpen sessions a week since January. ""But,"" the reliever added, ""still always different when you get a batter in the box. I haven't thrown to live batters. The arm is ready. Just kicking it into the next gear is going to be a challenge here in the next two weeks."" Washington opens the regular season March 28. Sipp threw a side session of 35 pitches Thursday, and Martinez said: ""My biggest thing with him -- and I talked to him yesterday -- is: 'As much as we want you for Opening Day, you missed significant time in spring training, so hopefully you're ready. But if you're not, you're not. But we want you to be fully ready, so if it takes you an extra three or four appearances down here, so be it.""
"
26025602,"The Cincinnati Reds star led the National League in on-base percentage last year but hit just 12 homers, his fewest in a full season, and batted .284, his lowest since 2014. He had 67 RBIs.
""It was the first year where I had a poor offensive year,"" Votto said. ""It is hard to speak on this without sounding arrogant. I've always performed at a certain level. Last year was a bit of a shock. I didn't perform anywhere near to what I'm used to.""
Votto, who turns 36 in September, was hit on the right knee by a pitch from Ryan Madson in August and went on the disabled list. His numbers were down even before the injury.
Votto hit 37 homers during his 2010 NL MVP season and had 36 with 100 RBIs in 2017. He spent this offseason refining his swing.
""I did things differently, so I hope it works,"" Votto said. ""Intuitively, I know why I wasn't ready and came up short last year. I just made sure I didn't do that again and learn from my mistakes. I feel very confident. I'm excited to work.""
Votto is owed $25 million annually through 2023, and the Reds have a $20 million option for 2024 with a $7 million buyout. He has spoken over the years about his desire to help the Reds become a winning team again.
Cincinnati overhauled its roster following its fourth straight season of 94 or more losses, adding starting pitchers Alex Wood, Sonny Gray and Tanner Roark along with outfielders Yasiel Puig and Matt Kemp.
""We've added All-Stars,"" Votto said. ""We've added guys with long track records. They have a lot of things to gain by playing very well here. Hopefully, we carry that into a winning performance.""
"
